post_id,user_id,text,timestamp,likes
314052,675586,"Lorem ipsum dolor sit amet, tempor sit non nulla habitant nulla a. Ante per eu efficitur augue odio blandit eu",2023-01-01T16:26:53Z,262272|654376|269527
644808,279853,"Lorem ipsum dolor sit amet, gravida libero ad aenean metus in. Velit consectetur est gravida bibendum interdum eu. Id quis",2023-01-01T20:27:19Z,957277|105301|525925
963180,760029,"Lorem ipsum dolor sit amet, pretium sit semper, ipsum semper morbi volutpat. Egestas, nulla aliquam maximus. Ac taciti odio interdum",2023-01-01T21:08:14Z,998915|197002
639966,585428,"Lorem ipsum dolor sit amet, in pretium. Posuere fermentum adipiscing sapien non a quam. Condimentum ante, mi, tincidunt ante elementum",2023-01-01T21:19:06Z,659512|381220|252113
937030,974067,"Lorem ipsum dolor sit amet, in tempor blandit duis et tellus. Et primis a tempus, quam dapibus. Quam mus sed",2023-01-02T00:32:59Z,639199|683652
764307,158431,"Lorem ipsum dolor sit amet, interdum quam nostra sociosqu nullam sed eget. Sem cubilia luctus eu diam tortor ac turpis,",2023-01-02T01:59:00Z,715177|791754|423404
991469,230812,"Lorem ipsum dolor sit amet, mollis vulputate vestibulum tortor eget tempus non? Porttitor nibh placerat, nisl ut primis. Magna amet",2023-01-02T08:38:25Z,46094
212614,627931,"Lorem ipsum dolor sit amet, arcu, rhoncus magna orci nulla semper finibus ac id in, risus. Felis massa ac ut",2023-01-02T09:08:36Z,337626
796752,300730,"Lorem ipsum dolor sit amet, ex sollicitudin a at ante, lectus tempus. Sed at sapien orci lobortis a nec leo",2023-01-02T11:32:31Z,529108|536241|361738|48718
27102,874678,"Lorem ipsum dolor sit amet, magnis amet ante senectus suspendisse nunc non. Sed sagittis nec eget quam purus est fringilla",2023-01-02T12:19:48Z,986660|247955|251546|27462|454945
644051,806651,"Lorem ipsum dolor sit amet, primis vitae quis dis finibus vulputate ornare vestibulum non. Vivamus tincidunt aliquam ac nisi, faucibus",2023-01-02T13:43:05Z,689044|656523|154354|675586|439965
195405,598188,"Lorem ipsum dolor sit amet, ipsum viverra magna senectus. Lectus maecenas sed, ipsum vel eget ullamcorper odio lacus pretium in.",2023-01-03T01:06:06Z,826140|157433|82130
949334,497243,"Lorem ipsum dolor sit amet, mi sed donec sodales pellentesque inceptos, duis nam eleifend vulputate. Cras purus id ipsum lobortis.",2023-01-03T02:12:31Z,604975|638427|428590|630386
521346,797681,"Lorem ipsum dolor sit amet, pellentesque nunc sodales hac massa, aliquam euismod. Accumsan in rutrum vestibulum facilisi vitae. At, himenaeos",2023-01-03T02:56:01Z,483947|198822|566767|715177|53614
990572,682222,"Lorem ipsum dolor sit amet, pellentesque non vitae maximus adipiscing. Primis pharetra sed ultrices gravida eu aenean. Libero velit sociis",2023-01-03T04:14:57Z,845787|459179|421012|232501|121289
285417,585884,"Lorem ipsum dolor sit amet, hendrerit fermentum nam at. A fusce odio urna semper sagittis curabitur auctor blandit. Augue et",2023-01-03T06:38:51Z,147209|692034|499533
505100,532579,"Lorem ipsum dolor sit amet, sed ut sollicitudin amet. Vestibulum laoreet feugiat. Hac porta tempus et varius eros sem dapibus!",2023-01-03T06:44:19Z,585044|436252|154698|669278
74408,906726,"Lorem ipsum dolor sit amet, aliquet, non netus nibh sed enim montes blandit finibus. Sed eu odio commodo eros efficitur.",2023-01-03T12:59:07Z,106802|971830|370693|58245|192356
14702,14359,"Lorem ipsum dolor sit amet, tincidunt quisque, nulla ut ac blandit penatibus class. Morbi et ut ultricies consequat amet donec",2023-01-04T05:17:54Z,513068
789399,764339,"Lorem ipsum dolor sit amet, ipsum et sed dapibus non leo pretium efficitur integer. Metus quam maecenas nibh nullam, egestas",2023-01-04T10:36:39Z,82130|255662|387131|131125|989556
512490,625439,"Lorem ipsum dolor sit amet, montes ex ante felis malesuada in ultrices est posuere. Sapien vel sed et vestibulum consectetur",2023-01-04T17:04:17Z,836719|238522
493086,155161,"Lorem ipsum dolor sit amet, mus et mattis nibh sociis interdum sagittis potenti, finibus a leo. Eget eros faucibus ut,",2023-01-04T20:32:16Z,904449|742850|862473|313047
188420,872541,"Lorem ipsum dolor sit amet, nullam lacinia, ex diam vel vivamus amet placerat, amet. Pulvinar velit consequat, sit non penatibus",2023-01-05T03:52:36Z,585884|611352|906006
460999,237110,"Lorem ipsum dolor sit amet, risus class, sit placerat vel, dui eu. Blandit arcu nullam urna dictum curae nostra ultrices,",2023-01-05T06:01:34Z,3721
219768,896688,"Lorem ipsum dolor sit amet, dictum molestie senectus, in ex. A tincidunt nunc egestas a phasellus sed! Justo hendrerit sed.",2023-01-05T08:29:22Z,479581|602026|222776|667714|575742
890051,45667,"Lorem ipsum dolor sit amet, id sociosqu quis cursus, pulvinar eleifend sapien enim. Ut, nostra maximus, donec urna est ut",2023-01-05T09:09:36Z,290365|837744|918757|186317|543736
426972,788382,"Lorem ipsum dolor sit amet, non vitae ridiculus malesuada ac ultrices auctor. Vitae aenean curae mattis rhoncus pulvinar nibh, congue",2023-01-05T09:13:27Z,232501|513068|836000
880223,831552,"Lorem ipsum dolor sit amet, vel sapien pellentesque in. Duis pulvinar pharetra, vulputate eros massa nascetur velit eget platea ultrices.",2023-01-05T09:40:53Z,626721|276406|466553
759402,169221,"Lorem ipsum dolor sit amet, posuere non, porttitor lobortis tempus ac, proin curabitur dictumst. Nulla ante venenatis, maximus etiam sapien",2023-01-05T13:17:06Z,345971|489940|418594|738583
241964,707842,"Lorem ipsum dolor sit amet, at in vestibulum tincidunt. Mollis vel auctor ornare praesent feugiat maecenas, augue. Quam malesuada porttitor",2023-01-05T15:29:00Z,225198
84374,389847,"Lorem ipsum dolor sit amet, rhoncus fringilla elementum mauris sollicitudin varius conubia lacus. Vitae in id ullamcorper nam vulputate, ut",2023-01-05T19:16:03Z,80176|594125
379251,605345,"Lorem ipsum dolor sit amet, est, est imperdiet. Nascetur turpis luctus rhoncus. Ridiculus ullamcorper consectetur tincidunt nisi turpis morbi? Et",2023-01-06T02:30:36Z,277273|127015|834964
865112,146383,"Lorem ipsum dolor sit amet, tempor blandit erat lectus cursus aliquet et lorem. Ut eu nec. Finibus ultrices, non quis,",2023-01-06T04:08:22Z,553676|834964
651433,654376,"Lorem ipsum dolor sit amet, ultrices diam in enim scelerisque praesent proin et egestas quisque. Phasellus augue tristique mi tempus",2023-01-06T07:06:10Z,465007|641064|707868
315751,522335,"Lorem ipsum dolor sit amet, quam, ut sociis risus, blandit lorem nam lobortis, odio. Morbi rutrum malesuada, ac nostra egestas",2023-01-06T09:15:00Z,627931|547439|20816|784097|988022
901277,997916,"Lorem ipsum dolor sit amet, erat nisl vitae non aliquam, iaculis vulputate eget tortor tellus. Quam luctus faucibus. Sed tincidunt",2023-01-06T15:56:52Z,625900
103585,165987,"Lorem ipsum dolor sit amet, orci et in. Nisl ipsum scelerisque habitasse amet tempor ipsum nec. Ridiculus et, nulla, egestas",2023-01-06T16:36:10Z,988377
848948,640701,"Lorem ipsum dolor sit amet, ac nostra, iaculis euismod lobortis ac et non metus sagittis! Pharetra eu montes ipsum nulla",2023-01-06T17:11:22Z,271861|368374|988377|894248
413445,464059,"Lorem ipsum dolor sit amet, pellentesque duis natoque vel vel consequat, dapibus. Donec quisque velit, erat, turpis tortor lacus nec",2023-01-06T22:01:22Z,14359|887807|91832|48718|9426
249778,283811,"Lorem ipsum dolor sit amet, vestibulum conubia posuere proin non natoque volutpat, erat proin. Posuere lobortis vitae habitasse, efficitur at,",2023-01-06T22:20:22Z,936329|451517|889208
271941,828726,"Lorem ipsum dolor sit amet, velit at bibendum ac dapibus. Tellus tincidunt sed phasellus sodales, amet metus lorem id mi.",2023-01-07T01:34:14Z,389847|256951
891188,299955,"Lorem ipsum dolor sit amet, cubilia sem vitae parturient sit placerat commodo non ipsum. Interdum sed id est eleifend quis",2023-01-07T01:56:35Z,136420
181744,308269,"Lorem ipsum dolor sit amet, et eget semper morbi quis in. Tempor arcu molestie ante malesuada. Iaculis cum nisl mi",2023-01-07T05:08:36Z,904449
938113,741889,"Lorem ipsum dolor sit amet, egestas nostra vestibulum pellentesque id, a aliquam nibh ac sed nec. Rutrum id, ac leo",2023-01-07T14:26:21Z,296197
272293,975922,"Lorem ipsum dolor sit amet, sed dictumst at quis eleifend eros tincidunt finibus. In, cum, amet inceptos montes eget ornare,",2023-01-07T18:31:54Z,745174|535887|55853|689044|455029
369483,88396,"Lorem ipsum dolor sit amet, dapibus taciti fringilla sollicitudin semper amet iaculis scelerisque orci. Diam est duis sollicitudin in lorem",2023-01-08T00:48:19Z,199109|246484
245709,91028,"Lorem ipsum dolor sit amet, eu nascetur cras pellentesque urna orci ante. Habitasse penatibus conubia imperdiet mauris sociis, ipsum ut",2023-01-08T02:45:26Z,675346|940618|598318|451056
997317,680889,"Lorem ipsum dolor sit amet, posuere, ligula dictumst duis mauris, eget bibendum, pellentesque ultrices mattis et hac. Velit et id,",2023-01-08T05:33:40Z,161221|889208|879748|210501
405933,711679,"Lorem ipsum dolor sit amet, habitasse eget potenti rhoncus himenaeos, proin diam. Nulla leo tincidunt eleifend nisl vitae volutpat est,",2023-01-08T05:55:34Z,420593|278049
762463,356655,"Lorem ipsum dolor sit amet, ligula in. Conubia erat lorem dictumst ut nisl vestibulum, feugiat. In ornare elementum. Luctus ut,",2023-01-08T07:01:02Z,116185
286902,139112,"Lorem ipsum dolor sit amet, ipsum nec platea molestie at sit ut sed. Eu montes velit justo accumsan volutpat elementum",2023-01-08T07:46:20Z,525925|879748|928383|149311
219358,887807,"Lorem ipsum dolor sit amet, parturient id elementum ut dolor donec felis ligula. Ante sem massa, auctor hendrerit nostra maecenas",2023-01-08T08:00:19Z,20910
695381,784097,"Lorem ipsum dolor sit amet, nostra congue sit molestie sit vulputate velit tincidunt convallis quam. Vestibulum mauris iaculis egestas tempus",2023-01-08T11:38:47Z,744201|748204|494556
447613,762270,"Lorem ipsum dolor sit amet, non id eget ultrices vel erat justo lacus. Finibus eu odio lorem, nam, eget mi",2023-01-08T11:54:42Z,10873|84349
368621,776993,"Lorem ipsum dolor sit amet, fermentum ligula magna, accumsan. Consectetur, sed, gravida accumsan fringilla tempus ex. Mi enim, ipsum mattis,",2023-01-08T12:23:16Z,209781|727113|729277
354813,686700,"Lorem ipsum dolor sit amet, tincidunt phasellus efficitur non, vestibulum ex faucibus turpis. Pellentesque pulvinar, in lobortis erat. Eu ut",2023-01-08T13:18:21Z,806651|9426
828231,966619,"Lorem ipsum dolor sit amet, ante enim tincidunt pellentesque arcu, amet erat a aliquet nunc. Nec magnis in neque facilisi",2023-01-08T14:07:35Z,157033|261026
689426,803614,"Lorem ipsum dolor sit amet, nec quis molestie sed penatibus torquent et. Ultricies nulla mus dictumst. Suspendisse fames ultrices nulla",2023-01-08T16:31:25Z,906726|189634|201391
409580,764339,"Lorem ipsum dolor sit amet, augue mauris velit proin, egestas lorem. Sed sed curae, lectus sed volutpat mauris quis ultricies",2023-01-09T00:23:45Z,797577|308420
872601,613879,"Lorem ipsum dolor sit amet, tincidunt ullamcorper integer elementum eu tincidunt, convallis senectus ut. Aenean tristique in parturient neque felis",2023-01-09T01:47:27Z,140064|51323|431908|672366|237110
22560,210633,"Lorem ipsum dolor sit amet, iaculis consequat nascetur molestie at per. Dignissim id gravida velit natoque tempus, sem ac maecenas",2023-01-09T02:47:01Z,146111|375603|707968|290029
337313,540978,"Lorem ipsum dolor sit amet, nostra vivamus vel congue facilisi. Neque blandit eros, gravida justo ac ut congue. Nisi duis",2023-01-09T04:16:39Z,841079
739947,733983,"Lorem ipsum dolor sit amet, scelerisque non nisl dui dolor nascetur. Nec, et morbi euismod ligula sit sit elementum et",2023-01-09T04:31:55Z,219435|479286
271214,206610,"Lorem ipsum dolor sit amet, platea, sit, dui nunc maecenas mi turpis quis lectus facilisi. Et condimentum justo, amet et",2023-01-09T04:39:52Z,225988|246046|840112|795571|589948
775438,35616,"Lorem ipsum dolor sit amet, justo, maximus cras adipiscing tincidunt interdum mollis. Lacus pharetra tempor ex lobortis euismod? Metus cubilia",2023-01-09T05:14:56Z,32723|21488|874763|731230|977988
907474,260860,"Lorem ipsum dolor sit amet, aliquet taciti porttitor massa ante orci tincidunt primis blandit fermentum mus. Condimentum suspendisse amet ridiculus.",2023-01-09T10:11:15Z,165308|735857
441464,481534,"Lorem ipsum dolor sit amet, nisl leo, turpis at sit tellus erat, placerat vitae ante mauris, ac integer. Ante amet",2023-01-09T16:23:28Z,561043
601807,652908,"Lorem ipsum dolor sit amet, ut bibendum at porttitor mauris. Ad velit varius. Suspendisse et ut donec tempus nunc mauris",2023-01-09T17:04:41Z,358450|127015|87948|892247|620457
927897,412338,"Lorem ipsum dolor sit amet, in dui scelerisque, cum, dis ac dui diam netus turpis. Magna nec consequat et turpis.",2023-01-09T20:27:23Z,806722|3524|332848|961742
135608,169723,"Lorem ipsum dolor sit amet, at cum ex ac quisque vel euismod sodales quis velit ullamcorper! Pellentesque lobortis, et imperdiet.",2023-01-09T20:35:24Z,302801|621069
726648,84869,"Lorem ipsum dolor sit amet, in praesent. Aliquam ac cras, quam sed nunc. Mus fermentum conubia finibus ac hac convallis",2023-01-09T21:52:36Z,436006|630386|458832|260601
412048,577896,"Lorem ipsum dolor sit amet, pharetra sed phasellus, scelerisque. Tincidunt nisi nunc ante arcu eu sit in. Maecenas venenatis egestas",2023-01-10T05:10:16Z,372373|304515|424112|445919|205536
75189,287877,"Lorem ipsum dolor sit amet, gravida sapien iaculis vel mattis praesent. Senectus sed, in, urna. Elementum mi magna scelerisque scelerisque",2023-01-10T14:20:16Z,161152|889208|836350|136420
782682,678722,"Lorem ipsum dolor sit amet, lobortis nec donec ipsum egestas sem eu, est. Erat et, at at suspendisse class! Sed",2023-01-10T15:40:49Z,73946|13164|131125|372373|465653
256306,582661,"Lorem ipsum dolor sit amet, venenatis luctus enim magna sed ac. Non fames aenean vitae, enim ac. Velit a nec",2023-01-10T16:06:17Z,727113|481114|811149
587023,740460,"Lorem ipsum dolor sit amet, eu id tellus et tellus curabitur lectus consequat. Ad dui vitae non, vel in a.",2023-01-10T20:31:58Z,220711|216837|908043|156176
346265,589948,"Lorem ipsum dolor sit amet, felis sit commodo ornare lorem cum. Finibus eget, a sociis ultrices ut dictum amet. Vel,",2023-01-11T00:51:00Z,652000
226800,568035,"Lorem ipsum dolor sit amet, facilisis himenaeos, tellus nibh egestas risus viverra sed enim tincidunt. Nisl erat iaculis interdum nullam",2023-01-11T01:15:13Z,258295
964834,186317,"Lorem ipsum dolor sit amet, et, diam eros arcu ut maecenas placerat. In felis dictum ultricies primis suspendisse sed hendrerit",2023-01-11T02:15:21Z,806651|970726|454051|495979
697696,116090,"Lorem ipsum dolor sit amet, et vitae ligula nibh, consectetur penatibus in dignissim fermentum justo, ultricies pellentesque. Sed nisl in",2023-01-11T03:29:10Z,190661|977988|367220|623650|620457
139662,922649,"Lorem ipsum dolor sit amet, nec et class tristique montes. Auctor orci laoreet pretium? Donec hendrerit at pretium ultricies vitae",2023-01-11T04:02:15Z,67253|577925|278049
567430,15588,"Lorem ipsum dolor sit amet, tincidunt dis luctus condimentum dolor quis phasellus sociis, parturient semper finibus faucibus. Sapien mus, libero",2023-01-11T04:44:20Z,75223|132702|683652
541476,591449,"Lorem ipsum dolor sit amet, ut, sed phasellus laoreet id odio ut habitant, suscipit. Duis at erat, lobortis justo dictumst,",2023-01-11T09:11:31Z,535887|605345|243599|711679
560779,321566,"Lorem ipsum dolor sit amet, quam, integer nunc ut eu ac in augue mus euismod. Ac sed mi taciti ornare,",2023-01-11T11:33:41Z,822503
762745,839223,"Lorem ipsum dolor sit amet, vitae non nisl ante tincidunt, purus erat ligula, class. Est ut potenti leo. Amet cum",2023-01-11T15:09:20Z,915910|610978
572499,973873,"Lorem ipsum dolor sit amet, massa platea erat a leo enim amet. Vulputate sem per sed turpis et erat justo",2023-01-11T19:48:36Z,110995
520696,965793,"Lorem ipsum dolor sit amet, donec bibendum eget a. Quam, proin per commodo ex, nibh in cras. Venenatis magna eu",2023-01-11T20:21:19Z,332848|387131
441124,354878,"Lorem ipsum dolor sit amet, vel fusce, cubilia sit tellus tempor nec, sed sed natoque. Sapien fusce enim pharetra et",2023-01-11T22:09:48Z,147977|110995|316403|222913|625900
928444,517337,"Lorem ipsum dolor sit amet, in auctor ligula elementum fames. Metus cubilia sed amet magna! A lorem, ornare erat fames",2023-01-13T01:26:30Z,746831
520992,737211,"Lorem ipsum dolor sit amet, blandit ipsum mauris finibus odio eu elit luctus non commodo. Fames pellentesque fermentum diam, feugiat!",2023-01-13T04:43:16Z,886748|502991|944729
544374,699605,"Lorem ipsum dolor sit amet, fusce, vestibulum felis ultrices rhoncus feugiat arcu urna. Eros felis viverra, arcu, ullamcorper cursus urna",2023-01-13T06:45:47Z,370693|194423|686700
493183,483947,"Lorem ipsum dolor sit amet, sit in magna mi tincidunt luctus ac ut. Eu senectus non eget. Elementum nam sapien",2023-01-13T08:46:05Z,234766|965829|269790|284809|627971
622309,784629,"Lorem ipsum dolor sit amet, taciti hendrerit ipsum penatibus non. Eleifend in sapien maecenas molestie magna turpis feugiat lorem, a",2023-01-13T12:09:21Z,314337
273894,548739,"Lorem ipsum dolor sit amet, a sed taciti praesent egestas nec. Vel sodales ligula odio nisi. Sit, cursus, netus semper",2023-01-13T16:50:20Z,675586|257011|602026|423404
673098,863395,"Lorem ipsum dolor sit amet, in ante facilisi nisi, vel magnis. Congue senectus commodo class pellentesque. Quisque nec enim ex",2023-01-13T16:57:17Z,605345|57518|585373|386329|928951
943062,182048,"Lorem ipsum dolor sit amet, tellus vel ut sagittis, eu nunc ligula sociosqu, senectus placerat pulvinar vehicula ipsum. Cras sem,",2023-01-13T19:16:53Z,879748|540978|136420|529108
707786,75790,"Lorem ipsum dolor sit amet, orci congue nostra adipiscing magnis. In massa ridiculus sed, vitae erat dolor non interdum tellus",2023-01-13T22:44:36Z,209343
424774,269790,"Lorem ipsum dolor sit amet, mauris aptent pellentesque ac velit aliquet aliquet augue, ante. Finibus egestas ut ultrices quis est",2023-01-14T01:36:47Z,830806|283875|125217|384276|689044
415533,246870,"Lorem ipsum dolor sit amet, platea rutrum id lacus. Curabitur habitant turpis nostra tempor nibh dui imperdiet nibh diam. In",2023-01-14T03:30:13Z,742002|798204|182609
41456,548739,"Lorem ipsum dolor sit amet, tortor mi pharetra, amet parturient a erat, hac sapien. Sociis penatibus etiam scelerisque curae ut.",2023-01-14T04:33:16Z,276756
706102,37626,"Lorem ipsum dolor sit amet, amet aenean eu penatibus ut metus pulvinar. Arcu morbi vel ligula viverra, eu lacinia faucibus!",2023-01-14T07:38:15Z,283811|941070|345971|745890
714292,29649,"Lorem ipsum dolor sit amet, interdum vehicula aenean magnis quisque sit, primis himenaeos. Mauris arcu dictum, accumsan, justo turpis, euismod",2023-01-14T08:57:05Z,495979|604975|696720|957418|9426
668248,101071,"Lorem ipsum dolor sit amet, egestas, integer sed iaculis ante pulvinar at. Mi diam ante luctus pellentesque justo nulla vitae",2023-01-14T15:21:47Z,576316|331344
169308,438046,"Lorem ipsum dolor sit amet, orci, porttitor ex. Iaculis vulputate lacus. Eget elit malesuada et potenti. Odio rhoncus, facilisis purus",2023-01-15T06:50:31Z,38091|117059
655908,445919,"Lorem ipsum dolor sit amet, non habitant eros quis, amet mi consectetur torquent mauris ut ut. Vestibulum porttitor varius quam",2023-01-15T12:25:02Z,594125|737724|727113|313047|508786
510213,156616,"Lorem ipsum dolor sit amet, placerat eu. In eros, ut rutrum sagittis quisque. Nec platea amet fames ac vulputate egestas.",2023-01-15T18:47:05Z,643572
727672,655470,"Lorem ipsum dolor sit amet, hendrerit risus metus, sed posuere eget non parturient. Risus eros vehicula, semper quis et quis",2023-01-15T22:14:23Z,237751
1294,201391,"Lorem ipsum dolor sit amet, pellentesque est egestas eleifend ultrices rutrum lacinia et mattis est mi. Curabitur ultrices, lorem in",2023-01-16T01:38:47Z,906006|797126|588578|660433
18861,320328,"Lorem ipsum dolor sit amet, eget nibh ac penatibus. Consequat vel sed conubia sit in mauris ornare massa vestibulum eget",2023-01-16T02:31:42Z,306441|102165
941052,3524,"Lorem ipsum dolor sit amet, sed fusce metus in ridiculus tincidunt penatibus suspendisse donec. Nisl, ac, et. Id maximus sollicitudin",2023-01-16T03:00:07Z,784629|290838|988022
172368,716673,"Lorem ipsum dolor sit amet, aliquam vestibulum hendrerit. Blandit, urna egestas elementum imperdiet. Donec porta neque libero id, et, at",2023-01-16T06:31:15Z,609786|85124|934224
561457,745174,"Lorem ipsum dolor sit amet, dis, congue ut nam at. Conubia eu enim egestas nisl! Pulvinar scelerisque aliquet lobortis dis",2023-01-16T13:14:37Z,247955|661595|214729|486109|572304
638109,117059,"Lorem ipsum dolor sit amet, pulvinar nibh sed, nisi ut. Viverra ex, adipiscing turpis arcu pretium. Tempor iaculis ut ac",2023-01-16T16:49:57Z,483947|219435|315325|955824
69457,537352,"Lorem ipsum dolor sit amet, imperdiet quam, id arcu ut lorem vel. Blandit, nulla per maximus et magna ex eros,",2023-01-16T23:07:01Z,345971|55853|658333
460537,140296,"Lorem ipsum dolor sit amet, nunc maecenas lacus cras, scelerisque sed. Tempus aliquam duis ligula nullam dolor. Consequat erat eros",2023-01-17T04:43:55Z,707968|132961|366692|387131
691339,466925,"Lorem ipsum dolor sit amet, condimentum dui ridiculus per aliquet, sed justo. Fusce magnis erat magnis, litora velit, cras. In",2023-01-17T04:48:18Z,731230|865300|784097|632750|46901
301339,828726,"Lorem ipsum dolor sit amet, parturient venenatis ad. Sagittis, accumsan neque libero egestas parturient ligula leo, quisque tristique consequat magna.",2023-01-18T02:22:38Z,105301|867581|973541|20816
146909,640701,"Lorem ipsum dolor sit amet, elit rhoncus habitant mauris maximus nam. Aliquet, maecenas hendrerit ante neque mollis tempus. Massa sagittis",2023-01-18T10:06:28Z,534552|208960|894248|654376|540978
687393,451056,"Lorem ipsum dolor sit amet, hendrerit donec quis litora amet vehicula eros amet cras suspendisse maecenas. Viverra sit sem vivamus",2023-01-18T10:35:09Z,113235|989556|570802|544285
788545,130565,"Lorem ipsum dolor sit amet, ut turpis odio malesuada rhoncus pulvinar at tincidunt eu ante. Enim placerat vitae nulla commodo,",2023-01-18T13:00:06Z,146521|361021|21518|186146
120761,180279,"Lorem ipsum dolor sit amet, ut euismod curabitur convallis at in quam, amet. Ex aliquam ut morbi faucibus pretium class",2023-01-18T13:58:13Z,343946
811646,152548,"Lorem ipsum dolor sit amet, commodo ac inceptos ultrices augue at, nulla etiam leo imperdiet et. Varius, ligula tempor magna,",2023-01-18T14:16:59Z,34301|904456|611044|3721
616244,15588,"Lorem ipsum dolor sit amet, ac egestas libero nulla dapibus odio orci. Laoreet condimentum finibus a habitasse ultricies fermentum lacinia",2023-01-18T15:07:10Z,165987|499533|531447|316357
863275,49027,"Lorem ipsum dolor sit amet, at purus amet in habitant, ex, hac mauris felis non. Nulla ex volutpat in ut,",2023-01-18T15:49:39Z,516176
274066,130565,"Lorem ipsum dolor sit amet, leo non nisl phasellus lectus auctor viverra senectus aliquam ultricies arcu vestibulum! Rutrum efficitur accumsan",2023-01-18T17:36:25Z,23780|334144|288396
700873,675586,"Lorem ipsum dolor sit amet, natoque tortor diam tortor dui posuere porttitor. Sapien, in, nec sed in turpis aliquet, vulputate",2023-01-18T23:47:31Z,994379|197002|290365
3805,206610,"Lorem ipsum dolor sit amet, tincidunt maecenas in nibh. Senectus orci id, sed orci vitae maximus hendrerit vestibulum. Dictumst sodales",2023-01-19T02:54:37Z,493616|34565|989556|582661|332848
250892,831543,"Lorem ipsum dolor sit amet, volutpat sed et a in nisl congue sagittis mus fermentum nisi. Sollicitudin sed, et tortor",2023-01-19T07:06:59Z,75790|944085|225782|502991
960679,458606,"Lorem ipsum dolor sit amet, quam bibendum fermentum nunc tortor, ex lacus. Varius fames conubia nunc, pellentesque in egestas. Mauris",2023-01-19T07:39:38Z,885888
360754,715177,"Lorem ipsum dolor sit amet, blandit arcu erat nec cursus amet est in vestibulum. Facilisis nunc nec luctus morbi nunc",2023-01-19T09:09:21Z,195268|936646
244846,290838,"Lorem ipsum dolor sit amet, et commodo nam sed malesuada, nec nisl, proin, donec eleifend id. Mi cursus donec vel",2023-01-19T10:29:56Z,121289
819356,585044,"Lorem ipsum dolor sit amet, felis congue ullamcorper vel enim ac. Efficitur fermentum eget aliquet tincidunt cursus vestibulum. Parturient vestibulum",2023-01-19T15:17:01Z,655451|32723|532494
20358,483235,"Lorem ipsum dolor sit amet, mollis senectus hac massa duis dis litora sagittis. Augue in habitant montes aptent aliquam varius",2023-01-19T21:10:49Z,361021|806722|674825|729277
570908,246870,"Lorem ipsum dolor sit amet, lacus et, leo ac consequat in fusce enim non mauris tincidunt. Tellus enim rutrum quam,",2023-01-20T06:01:28Z,214660|300730
844248,328040,"Lorem ipsum dolor sit amet, euismod suscipit elementum placerat tristique sed massa ac. Non eleifend. Tempor consequat justo himenaeos eros",2023-01-20T21:45:46Z,664556|664009
970590,652000,"Lorem ipsum dolor sit amet, purus interdum lorem efficitur et fames, amet. Conubia condimentum est ante ac imperdiet maximus pellentesque",2023-01-20T23:32:51Z,455792|105301|531447
846894,358450,"Lorem ipsum dolor sit amet, aliquet orci praesent magnis eros. Ac fringilla, ipsum ut. Taciti lacus ex, vel purus volutpat.",2023-01-21T01:46:52Z,380536
612481,220711,"Lorem ipsum dolor sit amet, ut torquent mus varius proin eros, consectetur bibendum venenatis ligula tempus, fusce. Auctor in ad",2023-01-21T05:40:16Z,799835|781636|34565
571628,334951,"Lorem ipsum dolor sit amet, bibendum placerat at ac commodo et. Eros dictumst varius vel montes augue curabitur lacus purus",2023-01-21T06:25:28Z,128806|368374|639199|346723|647969
960494,672366,"Lorem ipsum dolor sit amet, placerat nec bibendum elementum fermentum a etiam mollis vitae cursus amet. Dis quam ligula, sapien",2023-01-21T13:28:13Z,387131|517337|508145
