post_id,user_id,text,timestamp,likes
917984,323329,"Lorem ipsum dolor sit amet, sollicitudin odio volutpat diam gravida sem tincidunt. Sagittis himenaeos nisl sociis auctor purus in at,",2023-09-25T02:32:06Z,782825|957418|19083|86856|614244
34806,884578,"Lorem ipsum dolor sit amet, rutrum felis mauris est et velit nulla conubia. Ultrices metus felis facilisis tellus vel per.",2023-09-25T07:17:34Z,337626|225782|936329|154698|15712
874444,287877,"Lorem ipsum dolor sit amet, orci ut hac, turpis. Dui id et sit duis, eu nullam etiam sollicitudin. Malesuada congue",2023-09-25T07:27:56Z,661595|144987|189765|831552|522697
759903,902564,"Lorem ipsum dolor sit amet, aliquam placerat condimentum inceptos hendrerit nullam erat sed ornare congue. Facilisi odio volutpat eu penatibus",2023-09-25T10:36:52Z,976988|367220|513068|764084
30803,78723,"Lorem ipsum dolor sit amet, sit porta, turpis efficitur donec aptent egestas nunc. Iaculis, lacinia finibus nisi id facilisis porttitor",2023-09-25T13:47:23Z,970726|442907
40348,407675,"Lorem ipsum dolor sit amet, cursus mauris lorem ipsum phasellus magnis in nisl conubia aliquam aliquet. Ultricies aliquam enim egestas.",2023-09-25T20:58:56Z,830806|494825|436252|940618
808670,54836,"Lorem ipsum dolor sit amet, sem faucibus ridiculus in cum sociosqu, nunc non faucibus odio. Ipsum pulvinar nisl netus sagittis",2023-09-25T22:33:23Z,25653|352357|630386
766282,346785,"Lorem ipsum dolor sit amet, tellus bibendum, fusce, purus eu feugiat non phasellus. Commodo mattis posuere pretium libero natoque a",2023-09-26T04:08:32Z,188990|386329|46901
816323,784629,"Lorem ipsum dolor sit amet, maximus vestibulum pellentesque nulla curae orci. Eleifend dui at nullam erat sagittis cras ad. Eros",2023-09-26T09:24:25Z,745544
254193,901237,"Lorem ipsum dolor sit amet, leo diam ac leo, magna, eget orci, porta. Netus vitae egestas nullam maximus facilisis efficitur",2023-09-26T11:51:43Z,41447|920388|730083
511376,748654,"Lorem ipsum dolor sit amet, et tellus laoreet vel. Elementum lorem conubia pellentesque augue sed finibus augue sit vehicula. Tincidunt",2023-09-26T17:05:48Z,170243
626137,354187,"Lorem ipsum dolor sit amet, proin malesuada augue sed sagittis, velit condimentum vestibulum, finibus. Aptent et et mi in, nunc",2023-09-26T22:26:00Z,225198
381409,198822,"Lorem ipsum dolor sit amet, feugiat fermentum tortor primis dapibus curabitur consequat placerat, amet, dapibus. Vivamus nec, fusce efficitur litora",2023-09-27T00:10:58Z,762270|262272
560687,588578,"Lorem ipsum dolor sit amet, vivamus egestas commodo eget, pulvinar. Posuere eu aliquam, tellus cras mattis integer vel ut, netus,",2023-09-27T00:55:26Z,353499
224405,110995,"Lorem ipsum dolor sit amet, proin ante dolor purus tincidunt ad, vivamus nibh. Erat laoreet nunc, sit etiam vel ligula",2023-09-27T02:29:09Z,862763|649302|497243
578780,929449,"Lorem ipsum dolor sit amet, maximus vel, et? Nibh sed in tellus nascetur varius vestibulum felis quis in. In, ut",2023-09-27T06:30:06Z,326597
81531,649448,"Lorem ipsum dolor sit amet, consequat nam id dolor non egestas est sed. Est, imperdiet aenean, maecenas rutrum risus et,",2023-09-27T09:28:13Z,772458|611352|668451|247955
527048,825283,"Lorem ipsum dolor sit amet, nibh scelerisque ac mi erat, enim sed luctus tincidunt. Potenti sed metus cubilia quam massa,",2023-09-27T10:09:57Z,730083|262272|770784|257011
401316,413551,"Lorem ipsum dolor sit amet, vitae neque praesent mi lorem posuere conubia lorem proin sem. Tempor enim ac non, donec",2023-09-27T11:27:30Z,695517
577795,799835,"Lorem ipsum dolor sit amet, vestibulum pretium. Ante phasellus nullam tincidunt torquent ut egestas metus diam. Id tincidunt sem aenean",2023-09-27T12:21:33Z,614244|256951|358450|760387|695517
645591,55853,"Lorem ipsum dolor sit amet, nunc facilisis accumsan vestibulum odio penatibus nibh, vestibulum. Sed montes. Elementum ligula vel velit ultrices",2023-09-27T15:05:17Z,153560|703350|35616
257888,271294,"Lorem ipsum dolor sit amet, nunc et tempus morbi aptent, sit pulvinar nulla. Sed tortor sed ac ac. Vel, sem",2023-09-27T19:50:42Z,296197|906006
227933,971966,"Lorem ipsum dolor sit amet, commodo eget egestas, egestas justo vestibulum suscipit velit. Torquent dui molestie nisl ornare euismod vitae.",2023-09-27T20:23:01Z,90442
663537,4319,"Lorem ipsum dolor sit amet, non eget dui efficitur, justo etiam. Quis nisi eros egestas quisque sed non amet cursus.",2023-09-28T00:25:57Z,577925|58245|55853|649448
416780,906006,"Lorem ipsum dolor sit amet, quam sed magna erat vitae enim ac sociis maximus at! Maximus maecenas nullam luctus finibus",2023-09-28T07:30:49Z,581707|797126|594329|874678
615368,49027,"Lorem ipsum dolor sit amet, fusce vestibulum sagittis ad integer dictum consectetur sed, phasellus. Justo vestibulum himenaeos sollicitudin praesent ut",2023-09-28T09:56:17Z,918757
49470,975922,"Lorem ipsum dolor sit amet, at orci metus proin, sem magnis metus enim, fermentum tincidunt quis mattis quis. Placerat torquent",2023-09-28T12:48:06Z,937935|441079
280665,604681,"Lorem ipsum dolor sit amet, nullam nec, suscipit urna. Pulvinar aliquam suscipit, facilisi taciti natoque tellus nibh, vitae leo et",2023-09-28T15:06:05Z,361738
714235,687765,"Lorem ipsum dolor sit amet, vel ac risus vitae porta sapien ligula eu aliquam sit quis. Amet montes maximus arcu",2023-09-28T17:20:20Z,941870|55853|928951|47020
968743,994379,"Lorem ipsum dolor sit amet, parturient sed fames hendrerit cras adipiscing consequat eleifend in proin donec eu massa. Convallis facilisi",2023-09-28T17:45:54Z,346785|594235|566767
917937,934224,"Lorem ipsum dolor sit amet, lobortis vitae posuere, netus justo sed risus in lacinia vulputate sit. Dolor hac in aenean",2023-09-28T19:32:57Z,53614|219971
637379,393089,"Lorem ipsum dolor sit amet, leo nostra fusce malesuada vitae mi, in non lacus. A sociosqu sed ac. Nunc libero",2023-09-28T22:54:58Z,760934
285150,656290,"Lorem ipsum dolor sit amet, vestibulum a, sagittis in. Dictumst id ut nisl auctor aliquam. Libero natoque volutpat sem imperdiet",2023-09-28T23:37:56Z,315325|748204|743020
390450,541414,"Lorem ipsum dolor sit amet, augue dictumst donec ac sed blandit fusce nulla dictumst eu tellus platea. Etiam ridiculus non",2023-09-29T05:51:26Z,991190|16615
121656,537352,"Lorem ipsum dolor sit amet, aptent dignissim egestas. In sed placerat elit metus nostra, vitae? Nulla litora at massa volutpat",2023-09-29T10:39:01Z,409789
564118,216837,"Lorem ipsum dolor sit amet, nec vehicula, varius, ac at nulla mauris, vitae hendrerit tincidunt. Sed netus eu morbi, et",2023-09-29T15:29:28Z,371114|508786|611352|827794
911532,544285,"Lorem ipsum dolor sit amet, tempus varius eget amet dui libero in. Quis facilisis dolor enim erat velit fames. Ridiculus",2023-09-29T18:02:24Z,994824|624797|515564|466925
773509,738583,"Lorem ipsum dolor sit amet, sed nulla venenatis lacinia nunc ipsum in ut elementum. Ridiculus odio vulputate vel non integer",2023-09-29T18:13:47Z,237751|250166|655470|995214
886298,537479,"Lorem ipsum dolor sit amet, non torquent tincidunt sed felis lectus curae sed fringilla. Sed at faucibus netus maecenas dolor",2023-09-29T20:54:30Z,292038|224668|604681|367208
124722,120948,"Lorem ipsum dolor sit amet, sem volutpat sed sapien sed nostra imperdiet, duis duis diam. Cum nec pellentesque ac, ex",2023-09-30T05:34:51Z,458606|268173|990453|892247
411673,613879,"Lorem ipsum dolor sit amet, porta sit, purus at nullam, lorem nostra montes! Faucibus dapibus nisl sed ultrices vehicula pellentesque",2023-09-30T09:56:36Z,988377
889283,85124,"Lorem ipsum dolor sit amet, vulputate amet finibus est rhoncus et vitae. Ligula, ut diam lacinia. Praesent praesent eu tristique",2023-09-30T15:45:03Z,622347|687765|694911
486502,15588,"Lorem ipsum dolor sit amet, volutpat posuere in ac sociosqu urna, dapibus etiam. Praesent neque donec orci ac. Magnis justo",2023-09-30T21:25:13Z,314337|832791|689611|594329
541215,658333,"Lorem ipsum dolor sit amet, fringilla semper aenean diam felis interdum ac vitae lorem sed. Non, et augue ipsum amet",2023-09-30T23:11:29Z,235317
337931,375952,"Lorem ipsum dolor sit amet, class egestas libero et suspendisse eu enim. Mauris maximus est ornare eu risus dignissim facilisis,",2023-10-01T03:23:59Z,375952|250166|308420|37626
685226,328040,"Lorem ipsum dolor sit amet, eu tincidunt conubia finibus hac quam. Quis, libero est vitae neque lorem molestie tincidunt gravida",2023-10-01T03:27:01Z,44923|570353
234562,153560,"Lorem ipsum dolor sit amet, sed mattis fermentum donec quam eu. At cras sed nisi leo sociis aliquam. Ac vel,",2023-10-01T03:48:21Z,733983|73686
63551,403444,"Lorem ipsum dolor sit amet, eu sociis tortor turpis, ante turpis donec ipsum. Sed class, faucibus sed donec sodales vestibulum",2023-10-01T05:26:09Z,743020
611449,14359,"Lorem ipsum dolor sit amet, tincidunt congue taciti, nunc metus tempus felis semper viverra arcu tempor non ut cursus. Ipsum",2023-10-01T07:47:55Z,271861|219435|493616|489940
834504,885888,"Lorem ipsum dolor sit amet, nec cras quis et neque. Ac duis eu velit lobortis leo, nascetur phasellus ut lorem.",2023-10-02T04:14:13Z,264590
392444,614792,"Lorem ipsum dolor sit amet, nulla vitae nam, fringilla in, hendrerit. Ac rutrum laoreet magna vestibulum magna varius sed neque",2023-10-02T09:11:15Z,230812|662738|117059|3721|898349
972480,553676,"Lorem ipsum dolor sit amet, vitae in arcu, netus, leo. Pellentesque sed semper in nec feugiat amet sed. Ut tristique",2023-10-02T11:42:30Z,737211|566767|116185
518934,179021,"Lorem ipsum dolor sit amet, semper, leo suscipit, nunc. Sed, duis at turpis quam interdum mauris, imperdiet vitae metus platea",2023-10-02T11:44:11Z,971466|836350|973873|743340|906006
354710,16615,"Lorem ipsum dolor sit amet, curabitur risus sed semper fermentum. Sed sapien odio malesuada, non massa in. Sed facilisis augue",2023-10-02T15:02:35Z,237751|536325|29627|165987
410796,205536,"Lorem ipsum dolor sit amet, enim sed varius dapibus fusce sollicitudin ac ipsum. Urna turpis. Amet habitant semper eget a",2023-10-02T15:16:27Z,350832|516545|46094|609786|27462
613608,558783,"Lorem ipsum dolor sit amet, sed mauris maximus et tristique, sit amet euismod purus, molestie. Sed cubilia eget mi nullam",2023-10-02T17:13:48Z,152548|794454|558511|194423|904456
143730,323329,"Lorem ipsum dolor sit amet, orci urna rutrum ut. Commodo eget gravida lorem sapien, tellus turpis at sit. Pharetra dui",2023-10-02T22:02:11Z,375483|239833|678722
81568,455792,"Lorem ipsum dolor sit amet, in at ac ridiculus. Auctor faucibus nisl nisi a nec inceptos. Imperdiet amet, a eu",2023-10-03T09:00:55Z,189765|748654
553537,825283,"Lorem ipsum dolor sit amet, in massa et neque suspendisse? Nibh porta cum, praesent massa volutpat, neque nunc. Fermentum condimentum",2023-10-03T09:24:54Z,283376
998943,888233,"Lorem ipsum dolor sit amet, vivamus et sed elit sed dictum ac eros. Tincidunt enim ac sed turpis. Sociosqu fames",2023-10-03T11:09:48Z,835655|675270|389847
581307,619762,"Lorem ipsum dolor sit amet, tellus ut sit, etiam nulla. Per parturient in, lobortis cum ut donec mauris sollicitudin. Ut",2023-10-03T14:32:35Z,748301|420593|482367
477147,84349,"Lorem ipsum dolor sit amet, ex cursus quis varius ligula sociosqu ut felis non in mattis. Habitant mi ultricies in,",2023-10-03T16:48:03Z,970726|891587|585044|255662
603042,89989,"Lorem ipsum dolor sit amet, sed amet nascetur natoque turpis nec tellus. Lobortis montes suscipit enim nec ac ut dictum",2023-10-04T00:09:28Z,335845
596286,372373,"Lorem ipsum dolor sit amet, donec sociosqu, in maecenas facilisis. Vitae amet ornare. Vitae sed ut egestas, tempor arcu litora",2023-10-04T03:46:13Z,863395|32274|672366|802108|537284
989499,381060,"Lorem ipsum dolor sit amet, lobortis velit et sapien in torquent libero netus vel. Suscipit interdum nostra faucibus mollis maecenas",2023-10-04T06:42:29Z,962813|384276|283875|730083
33337,941070,"Lorem ipsum dolor sit amet, elit tellus laoreet ut nibh varius donec. Pretium curabitur, lectus odio eros, sollicitudin. Consequat natoque",2023-10-04T09:03:02Z,789225|246484|87948|570802|572304
407010,100653,"Lorem ipsum dolor sit amet, vehicula, semper ante proin nunc, laoreet. Maximus amet proin accumsan odio! Et metus hac eros.",2023-10-04T10:18:03Z,542881|578240|290365
205659,438962,"Lorem ipsum dolor sit amet, consequat aliquam molestie et vulputate. Quisque proin non id semper conubia curae et. Vel sit",2023-10-04T13:48:48Z,577800|58245
738822,44938,"Lorem ipsum dolor sit amet, varius, mauris mi sed litora blandit sit et. Dictum, urna arcu conubia finibus, accumsan mattis",2023-10-04T14:59:39Z,27462|626168|363983
775563,721072,"Lorem ipsum dolor sit amet, viverra penatibus in metus platea per et sit gravida pulvinar iaculis mattis. Tempus, in. Lorem",2023-10-04T21:44:08Z,553676|118746|458832|314662
850421,971966,"Lorem ipsum dolor sit amet, hac nulla porttitor, nec duis metus eu ut rutrum penatibus dictumst accumsan. Metus posuere senectus",2023-10-05T03:54:57Z,176701|367208
797505,559000,"Lorem ipsum dolor sit amet, egestas penatibus nam fames non ultricies ut mollis lectus tortor vestibulum eu aptent ut laoreet.",2023-10-05T10:03:28Z,868358
388230,187291,"Lorem ipsum dolor sit amet, ut erat hac. Proin sed penatibus tempus faucibus pharetra, ut tortor malesuada justo ultrices sed.",2023-10-05T15:53:21Z,805652|707842|837838
364797,614792,"Lorem ipsum dolor sit amet, ante cum sed orci ridiculus sodales iaculis dictum et fames. Molestie in tortor eu vel",2023-10-05T18:19:08Z,644052|822503|616779|159530
466408,577896,"Lorem ipsum dolor sit amet, ornare est sed sem ut maximus ut nunc aliquam egestas. Nisl eu donec augue in.",2023-10-05T22:51:40Z,465242
503568,434171,"Lorem ipsum dolor sit amet, dictumst nunc et blandit est ipsum, molestie, non. Laoreet ac nulla nulla, quis, nostra vehicula",2023-10-06T00:00:11Z,337626
205808,510949,"Lorem ipsum dolor sit amet, vivamus proin, augue molestie tortor. In enim dignissim molestie morbi ullamcorper justo. Eu id in",2023-10-06T03:12:26Z,840902|7180|874763|35616
394763,934224,"Lorem ipsum dolor sit amet, parturient nam aptent proin porta. Ut augue cum efficitur, commodo ligula, maximus congue. Turpis pellentesque",2023-10-06T12:55:40Z,23780|901935|559000|591227
711698,594329,"Lorem ipsum dolor sit amet, diam eu accumsan tempor elementum primis libero tempus. Justo interdum, sed semper nulla tincidunt sit",2023-10-06T13:59:52Z,707868|269056|364431|483195|597077
970499,707868,"Lorem ipsum dolor sit amet, est turpis a interdum, lacinia amet faucibus feugiat. Et facilisis, maximus leo accumsan a, mauris.",2023-10-06T15:12:07Z,382868|672198|175711|45630|558915
354093,594329,"Lorem ipsum dolor sit amet, tristique feugiat adipiscing at pharetra enim litora. Dictum, ante arcu consequat porta condimentum sed natoque",2023-10-06T21:52:21Z,884578|647969|544285|44923
358794,367208,"Lorem ipsum dolor sit amet, risus ac consequat sit ut maecenas sed. Sed pellentesque tempor justo ipsum sapien eros lorem?",2023-10-06T23:41:02Z,146521|482887|650175
98528,587904,"Lorem ipsum dolor sit amet, neque ligula, in bibendum dui tristique eget laoreet nisi ipsum. Suscipit ac litora amet, malesuada",2023-10-07T01:45:33Z,232867|238522|465653|536325|968214
244591,276406,"Lorem ipsum dolor sit amet, quam mus imperdiet, nisl eget augue luctus tellus. Quam quam morbi sed diam justo dis",2023-10-07T04:02:09Z,913763|658333|936704|627971
60810,525925,"Lorem ipsum dolor sit amet, praesent morbi nisl, nibh, class quam et condimentum, consectetur in, eleifend. Ac lectus urna nam.",2023-10-07T04:30:19Z,269056|436252|858463|553593
849935,424112,"Lorem ipsum dolor sit amet, sagittis amet elementum sociis nostra. Varius suscipit nisl suscipit. Consectetur ultrices dui nec aliquam vitae",2023-10-07T14:34:14Z,966619|436006
665420,292038,"Lorem ipsum dolor sit amet, enim placerat nisl ante dolor amet ridiculus ut non in. Porta at non augue donec,",2023-10-07T15:30:00Z,558783|573654
782835,442333,"Lorem ipsum dolor sit amet, molestie montes nulla, in quisque euismod nam non egestas pulvinar ac! Mollis sed mi nunc",2023-10-07T18:36:12Z,95498|702022|886099
764149,540978,"Lorem ipsum dolor sit amet, pellentesque consequat maecenas rhoncus. Cubilia nibh sed, urna magna malesuada. Proin vestibulum porttitor semper dictum",2023-10-07T18:39:01Z,4552|255662|967915
800400,67253,"Lorem ipsum dolor sit amet, felis semper facilisi conubia nibh ut laoreet neque in pharetra nibh a amet. Convallis, sed",2023-10-07T18:46:04Z,570802|877741|304560|703350
206662,201391,"Lorem ipsum dolor sit amet, blandit ante nec hac ut. Bibendum mauris mauris lacus sagittis, leo magna velit massa sed",2023-10-08T03:53:18Z,439965|449935|787400|989556
909680,201391,"Lorem ipsum dolor sit amet, in, platea at sed ipsum condimentum vel pharetra lorem. Egestas, curae elementum augue. Justo est",2023-10-08T04:02:08Z,783397|635534|772740
255155,902448,"Lorem ipsum dolor sit amet, justo ac sed felis lacinia, ante ipsum tellus, lacus. Urna, quis. Sem, ad vestibulum, congue",2023-10-08T15:43:36Z,772740|264590
646865,681910,"Lorem ipsum dolor sit amet, purus nec at in quis sed. Nec tristique tortor facilisis suscipit hendrerit neque in varius.",2023-10-08T20:41:17Z,337748
352299,744201,"Lorem ipsum dolor sit amet, sed tortor id tristique fames vitae. Odio, pellentesque. Fames vulputate cum tempus aenean quis. Leo",2023-10-08T23:16:41Z,90442|269790
306705,60125,"Lorem ipsum dolor sit amet, non risus, convallis ridiculus accumsan fermentum non. Placerat commodo egestas. Diam eget vestibulum cursus lorem?",2023-10-09T03:30:04Z,904449|161152|973845|988377|572304
407614,802108,"Lorem ipsum dolor sit amet, sed enim netus bibendum nulla vestibulum, varius vel eu netus. Fusce mauris senectus facilisis lacus",2023-10-09T15:51:14Z,530206|467745|84869
309382,535887,"Lorem ipsum dolor sit amet, et in dui in. Enim natoque amet ante risus iaculis metus lectus nibh. Tellus vivamus",2023-10-09T17:07:48Z,908043|654515|537479|788733|487932
239142,831552,"Lorem ipsum dolor sit amet, quisque faucibus, sollicitudin ligula congue, tincidunt. Nunc euismod mauris ornare sem platea habitant et. Erat",2023-10-09T19:41:11Z,806722|83042|215586|163107
6815,641880,"Lorem ipsum dolor sit amet, lacus dui congue mattis porttitor et a. Lorem id quam himenaeos praesent penatibus tristique netus",2023-10-10T01:03:02Z,840902|888583|941870
298873,882890,"Lorem ipsum dolor sit amet, sed eleifend sed et bibendum aliquam aliquam urna. Mi molestie sapien eros egestas tristique purus",2023-10-10T01:05:12Z,269790|136420
587851,735857,"Lorem ipsum dolor sit amet, non vestibulum in fermentum morbi semper ullamcorper accumsan. Condimentum massa amet condimentum magna egestas tellus",2023-10-10T01:25:20Z,268173|787813|737211|413551|252679
562112,641880,"Lorem ipsum dolor sit amet, sollicitudin, pretium enim habitasse id ante ac magna felis blandit sem? Auctor quam in ut",2023-10-10T03:47:19Z,772740
232361,887807,"Lorem ipsum dolor sit amet, eu ut at ut penatibus sed non lacus nam, congue. Lacus leo interdum sociosqu tempus",2023-10-10T09:48:29Z,289974|822503|762270
942980,639199,"Lorem ipsum dolor sit amet, varius erat pellentesque, nascetur, feugiat turpis, mauris velit odio erat. Lorem, risus finibus, quis, at",2023-10-10T12:15:38Z,229072|770784|337626
832451,699620,"Lorem ipsum dolor sit amet, eleifend sed, sapien urna consequat sed maecenas quam mauris. Luctus maecenas ullamcorper. Dictumst morbi, ex",2023-10-10T12:21:09Z,699620
104535,966619,"Lorem ipsum dolor sit amet, aliquam, habitant quis dui tempor, primis justo, ut sed nulla maximus. Eros, sed fringilla nunc",2023-10-10T14:18:05Z,764339|868358|276115|731518|269790
490045,553068,"Lorem ipsum dolor sit amet, ultrices vitae magna ut tincidunt. Sodales nisl dignissim in in, fusce congue penatibus, quisque. Odio",2023-10-10T14:27:48Z,617826|871498|136420|542638|687765
104011,157033,"Lorem ipsum dolor sit amet, eros hac cras finibus metus posuere tellus eu semper dictum justo. Eget mattis id mauris",2023-10-10T15:44:36Z,862473|513068
224533,313047,"Lorem ipsum dolor sit amet, ad gravida sit quam ultricies placerat urna id ullamcorper mauris a. Arcu ac efficitur feugiat",2023-10-10T19:41:27Z,152184|543736
370574,862763,"Lorem ipsum dolor sit amet, non eu odio. Vestibulum tortor massa quam. Auctor magna purus fermentum nulla orci eros, et.",2023-10-10T19:42:12Z,965793|576316|282295|425558
748318,386329,"Lorem ipsum dolor sit amet, quis finibus pharetra at, purus ligula curae luctus. Ultrices inceptos sed ut ut eu eu",2023-10-10T21:50:45Z,831552|432805|978817|338649|517337
716412,825962,"Lorem ipsum dolor sit amet, potenti at scelerisque nec non, egestas, tempus facilisi natoque imperdiet sociis. Luctus tristique amet mattis",2023-10-10T22:50:09Z,425558|290365
310176,790109,"Lorem ipsum dolor sit amet, lacinia, sed eros, nunc nulla luctus dapibus. Consectetur et vestibulum habitant, tortor pulvinar. Porttitor eu",2023-10-11T03:53:09Z,951718|625439|841079|235317|271294
455821,489940,"Lorem ipsum dolor sit amet, erat eu dolor maecenas eros efficitur, velit. Felis ut nulla at ac vehicula non, et.",2023-10-11T11:38:53Z,147977
952317,840112,"Lorem ipsum dolor sit amet, luctus facilisis ut phasellus purus in. Euismod tincidunt nibh hac fusce ut pretium. Massa sed",2023-10-11T16:46:02Z,100679|770800
228070,838850,"Lorem ipsum dolor sit amet, vestibulum sit sociis enim tempor viverra. Ac mauris montes, volutpat consectetur viverra molestie maecenas, tristique",2023-10-11T20:22:03Z,14359
722021,888233,"Lorem ipsum dolor sit amet, suspendisse curae conubia ultrices. Massa, sagittis condimentum nunc nec adipiscing arcu eget egestas vel. Ornare",2023-10-11T20:31:01Z,936329|711679|898349|175711|86856
320818,304611,"Lorem ipsum dolor sit amet, nunc eleifend ac efficitur sed justo nec netus diam eleifend. Ridiculus amet eu senectus sit",2023-10-11T21:20:21Z,21488|653345|581707|680889|458832
236955,711679,"Lorem ipsum dolor sit amet, potenti turpis, fermentum auctor non vitae ut elit nisl. Mollis ultrices habitant vel aenean amet.",2023-10-11T22:36:36Z,147209
230364,661595,"Lorem ipsum dolor sit amet, tempor ornare tempor, vulputate faucibus lobortis egestas. Enim condimentum in eu eleifend vitae viverra eu",2023-10-12T02:23:57Z,305462
425662,830364,"Lorem ipsum dolor sit amet, parturient velit tempor ullamcorper sollicitudin. Dolor neque cubilia odio porttitor amet, integer ut mi ac",2023-10-12T04:33:23Z,481114|243599|565279|149311
33009,995214,"Lorem ipsum dolor sit amet, sollicitudin pellentesque malesuada. Lacus ultricies metus mauris et, gravida a cubilia. Et fermentum non egestas",2023-10-12T07:07:10Z,192356|262272|840112
660557,698256,"Lorem ipsum dolor sit amet, nec elementum magna tempus lacus ac vestibulum, nec dictum, sed. Ac quam ad venenatis vulputate",2023-10-12T15:28:38Z,576316
342615,971966,"Lorem ipsum dolor sit amet, non libero sociis scelerisque etiam sit aliquam. Ligula nullam suspendisse, accumsan nibh vitae vehicula. Nullam",2023-10-12T19:22:16Z,436006|234766|59962|89989|256951
175388,381220,"Lorem ipsum dolor sit amet, elit hac, placerat nibh cubilia nam malesuada feugiat. Curabitur ligula a erat proin sit a.",2023-10-12T21:30:14Z,334951
302103,844733,"Lorem ipsum dolor sit amet, luctus scelerisque sagittis, facilisi mus ut mauris eget. Facilisis eu, neque porttitor placerat sed, cursus",2023-10-13T01:23:25Z,577925|872541
502693,260601,"Lorem ipsum dolor sit amet, commodo consectetur aptent ullamcorper vulputate. Primis ut vivamus adipiscing, taciti nisl consectetur. Penatibus molestie euismod",2023-10-13T02:38:09Z,639757|361738
906787,327154,"Lorem ipsum dolor sit amet, scelerisque mauris augue ut non est enim sit. Suscipit egestas eget sociosqu arcu nulla sollicitudin",2023-10-13T07:29:05Z,105301
794522,606086,"Lorem ipsum dolor sit amet, mauris nec praesent mi. Eros egestas nec tincidunt rutrum molestie proin. Faucibus, tristique nec dapibus",2023-10-13T07:41:35Z,287447|652000|826140|373011
317170,316357,"Lorem ipsum dolor sit amet, risus conubia. Facilisi massa nunc eros egestas quis velit fermentum imperdiet et. Mauris ac ex",2023-10-13T08:40:41Z,694911|466925|577925|894248|45667
287348,51323,"Lorem ipsum dolor sit amet, aliquam dolor aliquam quis accumsan eros convallis nunc ac porttitor. Lorem purus id elementum adipiscing",2023-10-13T14:22:37Z,451517|652908|689570
483040,250166,"Lorem ipsum dolor sit amet, metus aliquam litora amet, vel, curae suscipit hendrerit, etiam vehicula pellentesque metus neque nibh. Proin",2023-10-13T15:51:00Z,576316|610837|494825
873229,659512,"Lorem ipsum dolor sit amet, conubia non venenatis fusce quam pretium lorem dictumst ac ut vestibulum commodo sed. Auctor sociosqu",2023-10-13T20:16:24Z,532268|15712|117059
85584,815021,"Lorem ipsum dolor sit amet, auctor enim ac eros, donec facilisis. Interdum eros, cras. Maecenas fringilla. Et, leo massa sed",2023-10-14T00:33:10Z,75223|341431
236674,783397,"Lorem ipsum dolor sit amet, nec vestibulum, quam nullam cras! Curae, viverra, vel maecenas malesuada nostra mauris. Turpis, feugiat aenean",2023-10-14T06:33:19Z,358512|760387|826990
112290,743340,"Lorem ipsum dolor sit amet, nisi ac, eleifend pulvinar lorem nullam. Ac ornare ullamcorper congue vulputate, urna velit condimentum sed",2023-10-14T13:11:48Z,884019
695209,229072,"Lorem ipsum dolor sit amet, enim quis aenean duis euismod sed in. Vel mus orci ut nascetur nam netus, vulputate",2023-10-14T21:25:29Z,445919|889208|181643|983488|244723
728608,901935,"Lorem ipsum dolor sit amet, ornare, hendrerit litora imperdiet litora ac, penatibus nisi facilisis dapibus ipsum. Tellus, taciti, facilisi aliquet",2023-10-14T21:57:31Z,410277
875990,936329,"Lorem ipsum dolor sit amet, per etiam sit lobortis nec amet odio nibh ut a. Dis iaculis eleifend a suspendisse",2023-10-15T00:10:18Z,334144|672366|640236|875873|585428
