post_id,user_id,text,timestamp,likes
424364,352357,"Lorem ipsum dolor sit amet, et erat malesuada convallis ante ex. Facilisis sed. Ac, nam, himenaeos eu lobortis enim, adipiscing.",2023-06-14T14:27:37Z,349533|32723|788733|319726|121289
619609,331344,"Lorem ipsum dolor sit amet, vulputate nunc lorem. Libero aliquam, fames natoque aenean. Elementum torquent pharetra feugiat, enim turpis nascetur",2023-06-14T16:45:08Z,513068
783316,153560,"Lorem ipsum dolor sit amet, velit turpis in nascetur risus, eu ante at in suspendisse taciti. Congue ultricies lobortis ullamcorper",2023-06-15T04:31:50Z,954132|621069|614792|988377|940547
436319,23780,"Lorem ipsum dolor sit amet, dis ut dictumst donec odio, rutrum. Pellentesque sed, nam condimentum eleifend ex sem dolor. Mus",2023-06-15T04:52:16Z,659512|84869|977988
754888,341431,"Lorem ipsum dolor sit amet, praesent cubilia, eu torquent est leo. Ut ut iaculis dapibus nulla vestibulum lacus eleifend velit",2023-06-15T09:42:07Z,59962|152548|49839|784629|210501
823147,700939,"Lorem ipsum dolor sit amet, vehicula id quis aliquam nec tempus pharetra quis proin. Sed, libero sociosqu, egestas nec iaculis",2023-06-15T10:07:45Z,314337|290838|961742|276756|74028
526043,451517,"Lorem ipsum dolor sit amet, sed est at non hac ipsum nulla ut turpis. Nisi pellentesque eget risus nunc, congue",2023-06-15T16:53:08Z,941870|306441
327424,888583,"Lorem ipsum dolor sit amet, arcu odio lobortis purus, facilisis conubia in imperdiet tincidunt. Tristique eget lacus ac natoque, dictumst",2023-06-15T19:14:00Z,346774|789225|850677|717236
164287,841478,"Lorem ipsum dolor sit amet, proin sollicitudin eget, elementum hendrerit nec, nulla. Ad leo dictum inceptos consequat in turpis sociosqu",2023-06-15T21:56:10Z,824739|449935|205536|989556
701670,532268,"Lorem ipsum dolor sit amet, placerat purus eros tristique scelerisque turpis ligula penatibus. Consectetur quis ut donec turpis litora rutrum",2023-06-15T22:28:36Z,905747
976477,276756,"Lorem ipsum dolor sit amet, efficitur volutpat dui etiam enim tincidunt gravida mattis rhoncus finibus. Eros praesent, in ante non",2023-06-15T23:57:14Z,966619|243599|340942|416162|711679
285529,531447,"Lorem ipsum dolor sit amet, sociis porttitor malesuada leo etiam suspendisse, consequat libero pellentesque ut. Mauris accumsan ullamcorper risus eu",2023-06-16T00:31:06Z,983488|53614|250166
358252,237110,"Lorem ipsum dolor sit amet, a, himenaeos nisl enim in feugiat parturient sem molestie eleifend semper. Eu tempus, in, non",2023-06-16T04:27:47Z,675346|543386|776993
508291,836719,"Lorem ipsum dolor sit amet, cursus eget proin sed torquent interdum nulla. Dapibus ligula aliquam condimentum ad velit tellus suspendisse",2023-06-16T05:17:45Z,480601|531447|760387|49901
771544,375952,"Lorem ipsum dolor sit amet, vel eget nullam tempor lectus sed eget quisque sit. Vulputate scelerisque accumsan arcu turpis quis",2023-06-16T12:38:53Z,655451|675586
732175,354187,"Lorem ipsum dolor sit amet, litora vestibulum adipiscing lacus ac mattis, habitant, leo. Eu arcu parturient leo penatibus habitant natoque",2023-06-16T15:16:24Z,935591|346723
106645,611044,"Lorem ipsum dolor sit amet, nunc, ac cras leo vitae eros. Ac sed, et nec curae lorem. Lectus turpis netus",2023-06-16T16:24:22Z,163107|73567|675270|850677
495201,865300,"Lorem ipsum dolor sit amet, mus augue proin eget ultrices eros consequat nunc. Hendrerit, massa hendrerit adipiscing pretium, tempor mauris",2023-06-16T20:54:50Z,831543|331344|656523|811149|188990
29592,173816,"Lorem ipsum dolor sit amet, consequat in sed luctus semper lobortis. Tincidunt aliquam ut eu. Donec sed sed aliquam, accumsan",2023-06-17T01:26:26Z,827300
213421,868358,"Lorem ipsum dolor sit amet, nisl pellentesque magnis, sed at nec, phasellus dolor egestas vel et, nec. Sem tortor platea",2023-06-17T01:56:37Z,353499|888233|122161
413647,210057,"Lorem ipsum dolor sit amet, eget eget aliquam ex eros vel, ut varius nisl. Sed parturient gravida ut pellentesque euismod.",2023-06-17T19:48:45Z,442907|885888|255662|118746
627551,156616,"Lorem ipsum dolor sit amet, molestie enim ipsum laoreet in cursus rutrum. Et sit eget euismod in placerat turpis. Erat",2023-06-17T23:33:04Z,649302|313047|632750
271979,366692,"Lorem ipsum dolor sit amet, auctor hendrerit magna tristique, placerat, vel faucibus id augue ad torquent in phasellus. Dui maximus",2023-06-18T05:23:44Z,953976
310263,784097,"Lorem ipsum dolor sit amet, aliquam nascetur ex at nec. Convallis diam torquent ligula in eleifend, vitae. Lectus eget ullamcorper",2023-06-18T08:25:19Z,990363|516176|911885
66661,783216,"Lorem ipsum dolor sit amet, et, nisi ac posuere, sed sed parturient vel. Suscipit egestas ut dolor felis nostra nulla",2023-06-18T14:37:41Z,766786|668451|626721
121978,182048,"Lorem ipsum dolor sit amet, etiam maecenas elementum, non dolor tempus tincidunt justo et auctor, pellentesque lobortis. Facilisis a eu",2023-06-18T15:57:29Z,991190
452312,91072,"Lorem ipsum dolor sit amet, vulputate natoque vivamus semper suscipit class ridiculus lacinia. Et per ut maximus. Curae nostra sed",2023-06-18T17:43:53Z,731230|445919|390664|280932
372458,290029,"Lorem ipsum dolor sit amet, condimentum consectetur pulvinar. Sed leo lectus suspendisse gravida nisl sit auctor. Et auctor malesuada enim",2023-06-18T17:52:00Z,253467|146730|449935|278049
638370,988022,"Lorem ipsum dolor sit amet, nec massa leo elementum quam sociosqu. Sit vel mi vestibulum, dictumst porta nulla sed. Vel",2023-06-18T20:11:13Z,991190|356655
927996,650175,"Lorem ipsum dolor sit amet, a ante proin efficitur ut ultricies vestibulum, cursus tristique, at. At et, ac vivamus adipiscing",2023-06-18T22:35:08Z,86856|394066|661595
660909,224668,"Lorem ipsum dolor sit amet, magnis nibh. Diam consequat urna sed ante in ex ut vehicula sem, lacus pretium nascetur",2023-06-18T23:37:55Z,483947|114564|585373
717603,152548,"Lorem ipsum dolor sit amet, lacinia ut nec a conubia, non proin consequat eu in, metus ut netus euismod. Curabitur,",2023-06-19T01:47:27Z,948750|745544|394066
962406,595616,"Lorem ipsum dolor sit amet, taciti augue lorem ipsum sed sollicitudin amet. At at et mauris. Ut nullam porttitor augue,",2023-06-19T01:57:44Z,356737
222506,641064,"Lorem ipsum dolor sit amet, at facilisis eu nulla pretium urna eu finibus lacus dapibus porta. Varius eu sit sed",2023-06-19T05:00:23Z,867581
121558,828726,"Lorem ipsum dolor sit amet, eros quam per egestas cras proin. Pellentesque nisl, cras penatibus, ut nisi. Vel commodo in",2023-06-19T09:39:24Z,517713|83042|882890|841478
905801,196723,"Lorem ipsum dolor sit amet, placerat gravida tempus vestibulum faucibus, lacinia habitasse ligula pharetra. Non sit sed nec hac nibh",2023-06-19T11:27:02Z,264590|956490|909924|515564|791754
874286,640701,"Lorem ipsum dolor sit amet, imperdiet sollicitudin, ullamcorper pharetra. Fermentum sed suspendisse eu ullamcorper sodales. Nascetur eros laoreet nunc in",2023-06-19T14:10:24Z,368374|627931
319434,458606,"Lorem ipsum dolor sit amet, at iaculis porta senectus dictum nostra ut. Amet sed sed in sagittis mi sed cum",2023-06-19T19:22:16Z,716673|826990|41447|10873
110580,840902,"Lorem ipsum dolor sit amet, mauris et quam, nunc congue ac, natoque dictumst amet. Sit fringilla mattis sapien nostra. Ligula,",2023-06-19T20:08:34Z,354187|49027|57518|772458|426010
183668,748654,"Lorem ipsum dolor sit amet, metus nunc neque tempor felis, faucibus vitae potenti adipiscing. Porttitor lacus eleifend conubia libero, nunc.",2023-06-20T02:14:45Z,792409|620457|186317|222913|941870
800426,973541,"Lorem ipsum dolor sit amet, posuere in lectus in, auctor dis augue nec. Sed vitae tortor per sem purus. Id",2023-06-20T03:46:18Z,737211|179021
31031,458606,"Lorem ipsum dolor sit amet, condimentum integer fames risus potenti ac. Nisl amet sem odio sapien. Magna duis maximus taciti",2023-06-20T18:09:17Z,29989|836000
216236,194423,"Lorem ipsum dolor sit amet, lorem consectetur elementum ligula, magnis adipiscing risus sed. Nulla mattis lacus ornare pellentesque tempor, orci",2023-06-20T18:32:37Z,553199|189391|211209
324017,971966,"Lorem ipsum dolor sit amet, sit ut, sit a lectus morbi scelerisque ut. Tincidunt quis cubilia sed. Suscipit hac duis",2023-06-21T06:08:53Z,190048|517337|592200
708387,585884,"Lorem ipsum dolor sit amet, praesent maximus in risus aptent diam conubia. Ligula nibh lobortis sed nam. Quis nunc pellentesque",2023-06-21T07:28:41Z,117657|65983|796725|928383
489390,44916,"Lorem ipsum dolor sit amet, sed vel viverra, nunc sit nulla suscipit tellus aliquet finibus pretium sed. Non dictum. Integer",2023-06-21T18:17:23Z,73567|740460|986890|21488|936646
169663,840902,"Lorem ipsum dolor sit amet, maximus lobortis ante turpis duis diam purus enim habitasse, ante. Ultricies varius morbi in per.",2023-06-21T21:14:02Z,282139
645510,825962,"Lorem ipsum dolor sit amet, leo nullam tempor sapien tortor. In curabitur tempor in cubilia netus scelerisque, lobortis nec. At",2023-06-22T12:17:42Z,874678|399432
388647,940618,"Lorem ipsum dolor sit amet, posuere eros, nostra eget facilisis sed adipiscing vel. Rhoncus, quam sed natoque himenaeos, nunc vel",2023-06-22T13:47:07Z,156616|284910
949342,944729,"Lorem ipsum dolor sit amet, nec sagittis massa ultrices mauris vulputate id laoreet neque eget, aliquam non. A magna posuere",2023-06-22T15:56:36Z,21518|16615|300730|232867|438046
19006,278049,"Lorem ipsum dolor sit amet, eros lacus ipsum ac vitae platea. Id accumsan sit metus ad class ultricies dapibus. At",2023-06-22T22:16:54Z,125217
727185,60125,"Lorem ipsum dolor sit amet, adipiscing ante, accumsan, feugiat risus scelerisque nulla, fusce, adipiscing est, torquent a. Hac porttitor nisi",2023-06-22T23:57:33Z,887807|442907|536241
303374,595246,"Lorem ipsum dolor sit amet, cursus sed hac nostra primis eros cursus sit lacinia donec. Netus libero aptent, sit conubia",2023-06-23T01:16:47Z,375952
232975,828429,"Lorem ipsum dolor sit amet, amet taciti velit commodo in, lectus. Sem, elementum ut nec eu sagittis lobortis et phasellus",2023-06-23T01:18:23Z,698256|84869
391563,116185,"Lorem ipsum dolor sit amet, ipsum lacinia curae, euismod lectus urna quam pharetra congue velit et. Aenean eros adipiscing primis.",2023-06-23T09:24:48Z,206610|384276|425558|53614|836000
343744,80176,"Lorem ipsum dolor sit amet, sit quis rutrum eu. Phasellus in non faucibus. Tempor, est magnis tincidunt et ligula ut.",2023-06-23T12:51:34Z,654376|554352|874763|127015|201391
380899,955824,"Lorem ipsum dolor sit amet, ut ipsum eget venenatis felis lacus sed et eu ligula. Sit ligula pulvinar, at elit",2023-06-23T17:13:05Z,502991|938736|89989|617826|516176
830379,772458,"Lorem ipsum dolor sit amet, sed mi aliquam lacus lectus luctus accumsan placerat. Condimentum ullamcorper sapien diam facilisis mattis et",2023-06-23T19:02:18Z,532268|45630|364431|598188|114564
675759,954132,"Lorem ipsum dolor sit amet, non commodo ut litora sagittis euismod. A vestibulum phasellus, lectus urna. Fames dolor suscipit, dapibus",2023-06-23T20:33:44Z,707968
578243,845787,"Lorem ipsum dolor sit amet, pellentesque odio duis ultrices, phasellus pretium, ultrices ante pharetra. Ultrices mi in nec, velit non",2023-06-23T23:13:52Z,928383|704431|573788|915910
449772,703405,"Lorem ipsum dolor sit amet, porttitor tortor gravida vulputate ac vestibulum mattis velit montes. Laoreet fames sapien finibus suspendisse lorem",2023-06-23T23:33:26Z,689611|878778|836350
358046,885291,"Lorem ipsum dolor sit amet, dis conubia scelerisque. Erat dolor urna eu quis purus, vel blandit. A varius egestas arcu,",2023-06-24T04:28:53Z,367208|216518|121671|41447|480538
146588,936329,"Lorem ipsum dolor sit amet, justo amet condimentum sit sed congue maximus? Tellus ligula non aliquam ad commodo vehicula. Quam",2023-06-24T10:18:10Z,845787
38819,161626,"Lorem ipsum dolor sit amet, lacus, non montes finibus suspendisse risus. Amet dictum ut himenaeos at aenean. Malesuada dictumst etiam",2023-06-24T18:56:52Z,729277|53614|382868
140571,214729,"Lorem ipsum dolor sit amet, curabitur auctor at, tincidunt aliquam vestibulum viverra, nostra. Augue, eleifend, non etiam magna integer imperdiet",2023-06-24T21:01:22Z,29649|86856|276769
83851,543386,"Lorem ipsum dolor sit amet, cubilia nec ante lectus nullam rhoncus sed. Mi imperdiet in habitant tristique sed platea vestibulum",2023-06-25T00:46:17Z,416516|902564|169723|784097
593258,827300,"Lorem ipsum dolor sit amet, orci, pulvinar ligula dictumst donec ante et ante sed in! Tellus, et augue non donec",2023-06-25T04:34:25Z,382868
511468,839223,"Lorem ipsum dolor sit amet, non sit molestie ut. Eget eget vehicula ac non in dictum gravida semper per nullam.",2023-06-25T09:20:06Z,911885|962813|196723|988377
425339,352357,"Lorem ipsum dolor sit amet, in per vestibulum, vivamus amet amet fermentum. Hendrerit et purus quis bibendum risus. Eu, amet",2023-06-25T11:43:26Z,823569|611044
824456,832791,"Lorem ipsum dolor sit amet, a enim ac sed at, nunc in varius imperdiet class? Natoque himenaeos faucibus magna a",2023-06-25T12:22:22Z,934224|672366
840809,760387,"Lorem ipsum dolor sit amet, habitasse nam neque leo pulvinar netus at nullam vel, duis libero. A vitae senectus, lectus",2023-06-25T17:21:50Z,920388|393089|252679|269527|87948
822530,613879,"Lorem ipsum dolor sit amet, lacus curae nisl. Ligula libero posuere suscipit quis at sed duis pharetra. Consequat facilisis rhoncus",2023-06-25T18:12:01Z,483195|748301|339967
612348,976988,"Lorem ipsum dolor sit amet, sit mauris cursus fermentum in vel. Sed cum curabitur iaculis proin amet nec, lobortis mauris,",2023-06-25T19:49:31Z,243599
755868,367220,"Lorem ipsum dolor sit amet, dolor natoque, mattis nisl nec faucibus enim eros sed lacinia. Id nunc ut purus eleifend",2023-06-25T23:38:05Z,828726|214729|431908|368374|146111
795942,432805,"Lorem ipsum dolor sit amet, eu turpis taciti, sagittis egestas. Urna eros netus suspendisse ipsum amet, enim integer proin a",2023-06-26T00:42:48Z,132961
583020,11250,"Lorem ipsum dolor sit amet, condimentum diam a lorem vitae non odio, dolor. Felis, nunc felis pretium mollis non rutrum",2023-06-26T06:25:05Z,792409|269056|23780
280794,321639,"Lorem ipsum dolor sit amet, urna taciti nisi in lorem in praesent tortor. Cum ac sapien in tristique lorem ut",2023-06-26T21:30:18Z,836350|764084|577896|782825
624945,671388,"Lorem ipsum dolor sit amet, habitant et interdum, nam integer, auctor pellentesque volutpat mauris, in. Sed volutpat ante ligula sagittis",2023-06-27T05:31:22Z,679245|308269|828429|796836
532817,685053,"Lorem ipsum dolor sit amet, bibendum nibh adipiscing tincidunt. Tempus porttitor, ullamcorper lobortis cras. Phasellus cursus tristique fames fermentum phasellus",2023-06-27T14:30:12Z,577925|32723|655470
956801,828429,"Lorem ipsum dolor sit amet, ultrices augue risus efficitur ut sit? Donec nisl netus vivamus convallis enim class sed, lobortis",2023-06-27T16:59:41Z,650175|730083
139265,136420,"Lorem ipsum dolor sit amet, sed luctus pretium nunc congue dis commodo. Viverra nisi donec in. Parturient eget sit senectus",2023-06-27T19:04:00Z,641064|762270|936704|253467|596367
286931,806722,"Lorem ipsum dolor sit amet, dignissim sem semper consectetur vel massa. Felis accumsan ligula sed vitae libero cum donec in.",2023-06-27T20:58:13Z,643572
513641,612097,"Lorem ipsum dolor sit amet, at purus sed scelerisque consectetur sem finibus ipsum, neque efficitur nec turpis! Sed mi et",2023-06-27T22:13:22Z,271867|364431|300730|872541
510691,855578,"Lorem ipsum dolor sit amet, elementum eros faucibus inceptos. Dolor et sit condimentum, maecenas volutpat amet nunc duis. Netus magna",2023-06-27T22:34:29Z,127015|276769|745890|411015|120948
845977,189765,"Lorem ipsum dolor sit amet, nec et nunc velit in suspendisse aptent vestibulum nisl. Mi vitae volutpat luctus, aliquet euismod?",2023-06-27T23:53:58Z,219435|796725|269056
154411,616779,"Lorem ipsum dolor sit amet, augue dolor quisque, litora. Phasellus tellus non turpis in dis. Sed sed vestibulum commodo. At",2023-06-28T05:23:38Z,605345|452539|290365
528527,185929,"Lorem ipsum dolor sit amet, eu aptent sociosqu. Facilisi cubilia eleifend nisl est egestas sodales dapibus. Penatibus sed fermentum pellentesque",2023-06-28T07:36:55Z,971784
932972,368374,"Lorem ipsum dolor sit amet, dapibus nibh eros velit maecenas, vitae lectus vitae quam elit. Nec ut, in et non.",2023-06-28T12:28:51Z,516369|662738|65274|351456|10168
371581,88396,"Lorem ipsum dolor sit amet, sollicitudin ac, ut ligula. Felis molestie nulla. Lorem laoreet vel eu libero ac. Nec vehicula",2023-06-28T13:59:07Z,146521|976988|543386
877484,549412,"Lorem ipsum dolor sit amet, malesuada eros laoreet parturient! Convallis nulla litora sed penatibus nec egestas, cras et magna. Morbi",2023-06-28T19:10:10Z,337626|409789|877741
125462,612434,"Lorem ipsum dolor sit amet, et, vitae vel curae felis, dapibus eget, dictumst parturient per nec. Lectus tristique ullamcorper quam",2023-06-28T22:43:16Z,483195|201701|140296|105301|838850
694352,158431,"Lorem ipsum dolor sit amet, nec enim diam tortor odio nam curabitur et aliquam pretium diam. Nec aenean convallis vel,",2023-06-29T00:15:57Z,449935|244879|91028|182609|130565
949295,314662,"Lorem ipsum dolor sit amet, iaculis integer ultrices nibh consectetur maecenas nec, id vehicula. Nulla magnis sagittis fermentum commodo urna",2023-06-29T06:27:32Z,343946|891587|742761
209995,823569,"Lorem ipsum dolor sit amet, in class venenatis, ex? Tincidunt potenti senectus risus at viverra ante. Fames ut vitae nunc.",2023-06-29T07:44:06Z,4552
353708,277273,"Lorem ipsum dolor sit amet, diam cras nibh, amet blandit id amet lacinia varius. Odio fusce tempor, dolor lacinia ac",2023-06-29T10:12:15Z,797681|345971|983488|766786|700939
965980,936329,"Lorem ipsum dolor sit amet, in erat et integer volutpat egestas. Varius nec magna, varius, tempor erat. Sociis varius gravida",2023-06-29T11:14:05Z,290838
838072,283811,"Lorem ipsum dolor sit amet, massa pulvinar ut sem mi ante sit sed. Nulla mi mi semper suspendisse. Mauris non",2023-06-29T12:54:52Z,106179|314662|784629|828726
779493,29649,"Lorem ipsum dolor sit amet, ut nisl sed, leo venenatis, luctus, dapibus taciti tempus vitae varius quam vestibulum. Lobortis condimentum",2023-06-29T14:47:15Z,644052|321104|369169
844363,483938,"Lorem ipsum dolor sit amet, hac quis et, curabitur pharetra ut tincidunt primis per. Fusce sed, sociosqu sed ac netus",2023-06-29T16:58:41Z,366692|672366|806651|513068
446714,32274,"Lorem ipsum dolor sit amet, nec pellentesque arcu accumsan! Varius iaculis neque posuere elit, duis varius posuere nisi. Vel amet",2023-06-29T20:12:16Z,13164
166278,147977,"Lorem ipsum dolor sit amet, inceptos cum sapien vel, etiam. Velit amet urna. Tellus amet arcu sed auctor ut duis.",2023-06-29T23:11:25Z,210633
888329,990363,"Lorem ipsum dolor sit amet, curabitur nostra nunc felis quis eros accumsan tincidunt. Nullam at mauris lobortis eleifend nostra ultricies",2023-06-29T23:43:24Z,106802
909898,655470,"Lorem ipsum dolor sit amet, vel risus pellentesque dis phasellus, sed vitae turpis. Nunc vitae arcu, ut amet ligula auctor,",2023-06-30T04:10:14Z,802108|382868|404303|743340
218994,334951,"Lorem ipsum dolor sit amet, orci at duis cum et vulputate, sed in nec per. Dui magnis malesuada penatibus dui",2023-06-30T04:33:34Z,655470|965793|284809|451517|260860
96015,179021,"Lorem ipsum dolor sit amet, sagittis tristique, pulvinar ornare purus ligula sem malesuada non velit dui at maximus. Accumsan justo",2023-06-30T05:44:50Z,508145|536241|737724
81835,14359,"Lorem ipsum dolor sit amet, mauris posuere, primis in sed posuere turpis et sociis mauris pretium. Ut libero et dolor",2023-06-30T09:44:52Z,358512|762270|364431|884019
828294,804982,"Lorem ipsum dolor sit amet, fringilla justo ut interdum, neque maximus ac parturient facilisis. Sollicitudin sed litora ultricies massa fusce.",2023-06-30T10:05:04Z,827300|195268|741889
99145,140064,"Lorem ipsum dolor sit amet, tempor nam sem dolor sollicitudin egestas. Senectus at, congue quis tincidunt sollicitudin rhoncus proin lorem,",2023-06-30T14:16:34Z,994824|426010|862364|165987|290029
98175,517713,"Lorem ipsum dolor sit amet, metus aptent curae vestibulum, metus, erat, lacinia. In consequat ut risus praesent. Hac lorem vestibulum",2023-06-30T14:20:34Z,805652|882890|225198|292038|153560
202859,110995,"Lorem ipsum dolor sit amet, tellus varius dictum luctus condimentum. Sit lobortis urna mauris facilisi nibh dui nisl sed. Fusce,",2023-06-30T16:21:02Z,858463|862763|232867|731518|536325
714125,65983,"Lorem ipsum dolor sit amet, dolor suspendisse, faucibus libero, mi velit tincidunt suspendisse sed curabitur. Lacus diam vel dictum massa",2023-06-30T18:13:12Z,836622|91832|971784|604975
335607,469053,"Lorem ipsum dolor sit amet, in placerat felis in faucibus molestie, varius. In vulputate, dictum vitae in, quis arcu. Odio",2023-07-01T03:30:43Z,783216|450715|828429|585373
144824,313047,"Lorem ipsum dolor sit amet, nam turpis dapibus nibh sodales, sed leo vitae sed. Tincidunt odio mi, malesuada in, ut",2023-07-01T04:04:27Z,655470|640732
163348,605070,"Lorem ipsum dolor sit amet, nostra sit erat etiam urna, nisi nec. Cras elit malesuada maximus nulla non lorem. Ut",2023-07-01T11:31:54Z,421012|553676|264376|238992|404140
337896,411015,"Lorem ipsum dolor sit amet, auctor nulla tincidunt mus blandit non. Justo aliquam id laoreet litora vestibulum libero, scelerisque. Sed",2023-07-01T15:07:55Z,770800|165987|909924
782318,83042,"Lorem ipsum dolor sit amet, ultricies sed magnis ridiculus sociis mi ut natoque finibus nunc pellentesque praesent, auctor. Magna pretium,",2023-07-01T19:31:25Z,733529|15588|432805
389766,764339,"Lorem ipsum dolor sit amet, et non dolor, suspendisse in? Egestas ut quis, commodo egestas interdum, eget amet vitae odio.",2023-07-01T19:49:14Z,122161|457398|146960|481114
820059,917473,"Lorem ipsum dolor sit amet, nibh, consectetur elementum tristique, vel, himenaeos. Dignissim, venenatis, nostra ad amet risus. Vehicula fusce cras",2023-07-01T21:23:13Z,850677|889208|838850
145636,588578,"Lorem ipsum dolor sit amet, urna leo convallis at dapibus commodo sed leo. Pellentesque fusce proin dolor. Congue, libero fames",2023-07-01T22:24:42Z,290029|201701|8299|782295
736731,260860,"Lorem ipsum dolor sit amet, vestibulum efficitur ac auctor gravida scelerisque taciti. Euismod imperdiet aliquet feugiat ut cubilia varius vitae.",2023-07-02T03:29:40Z,157033
520222,86856,"Lorem ipsum dolor sit amet, magnis adipiscing ac senectus ut enim natoque at arcu. Risus inceptos, arcu ut ut interdum",2023-07-02T03:40:47Z,328040|487932|222913
733192,16615,"Lorem ipsum dolor sit amet, eu scelerisque et volutpat ligula hac, commodo. Est ante lobortis ut parturient. Nunc curabitur orci",2023-07-02T04:23:12Z,194753|209343|831537|652840
611367,384276,"Lorem ipsum dolor sit amet, ullamcorper odio purus et vitae lobortis sed eros. Vel ut volutpat tristique ut nibh orci",2023-07-02T10:05:38Z,482367|179707|743020
514230,542881,"Lorem ipsum dolor sit amet, vel mollis at eu phasellus natoque inceptos sed. Sed justo lorem pharetra lacinia non in.",2023-07-03T04:17:01Z,836350
510898,891587,"Lorem ipsum dolor sit amet, fames metus amet vitae ac porttitor sodales, fermentum vestibulum placerat, dignissim hendrerit facilisi. Nam accumsan",2023-07-03T04:57:17Z,4552|888583
308365,251546,"Lorem ipsum dolor sit amet, et a eget ligula vel, adipiscing ipsum. Quam volutpat torquent sed scelerisque magna, sollicitudin quisque",2023-07-03T06:12:51Z,578240
368357,874678,"Lorem ipsum dolor sit amet, lectus eu, sed auctor sit. Blandit habitant nec interdum taciti in mollis. Nisi pharetra orci",2023-07-03T11:53:58Z,951686
342791,915910,"Lorem ipsum dolor sit amet, habitasse tristique taciti interdum ligula eros imperdiet pharetra turpis erat. Libero suscipit pellentesque justo non",2023-07-03T13:03:53Z,482367|640236|184631|743592
131904,206145,"Lorem ipsum dolor sit amet, torquent porttitor suspendisse, massa, eros natoque in tincidunt praesent aenean. Imperdiet ut sed, pellentesque orci",2023-07-03T14:28:05Z,532268|790109|826140|220711
387702,82333,"Lorem ipsum dolor sit amet, himenaeos nisl erat. Pellentesque feugiat nullam arcu sed donec in efficitur in fames. Est fermentum",2023-07-03T14:43:06Z,458606|795571|537479
310219,542638,"Lorem ipsum dolor sit amet, cubilia nibh curae praesent vulputate amet duis vel eleifend. At, lacinia sed maximus auctor iaculis,",2023-07-03T16:54:42Z,384276|358512|986890|308269
428158,898349,"Lorem ipsum dolor sit amet, eu condimentum dui, vehicula ullamcorper mauris neque. Sodales proin dictum justo litora non fringilla, nibh",2023-07-03T20:04:51Z,451056|283875|576247
419342,975922,"Lorem ipsum dolor sit amet, donec viverra torquent, senectus, urna ligula. Natoque conubia, platea nullam. Ac vel elementum sed ullamcorper",2023-07-03T21:07:08Z,830364|654376
563524,867035,"Lorem ipsum dolor sit amet, tincidunt blandit non montes nunc non at id. Id, iaculis nam, dictum lobortis luctus magna",2023-07-03T21:54:27Z,840902|836350|162284
195307,836719,"Lorem ipsum dolor sit amet, rutrum malesuada est accumsan sodales nam netus. Porta egestas massa, nibh ac. Amet primis non.",2023-07-03T22:15:16Z,466925|928951|246484|594235|357228
548802,424112,"Lorem ipsum dolor sit amet, augue at curae sed risus, imperdiet velit nec ut sagittis vel. Egestas primis senectus laoreet.",2023-07-04T02:29:50Z,225782|840112|20816|661595
398661,936704,"Lorem ipsum dolor sit amet, etiam imperdiet imperdiet enim. Rutrum, velit eros, nascetur sed penatibus nunc egestas, libero commodo. Id",2023-07-04T03:03:51Z,245648|257011
473091,940191,"Lorem ipsum dolor sit amet, in eu lectus amet ac eros ligula? Ad in convallis justo. Nec elit convallis amet",2023-07-04T07:16:35Z,321566|188990|368367
151628,210501,"Lorem ipsum dolor sit amet, aliquam mattis porttitor nec tincidunt eu integer phasellus conubia! In sodales nibh nunc eros integer",2023-07-04T14:57:27Z,375351|941870|792409|480538
