post_id,user_id,text,timestamp,likes
504330,532579,"Lorem ipsum dolor sit amet, tincidunt vivamus sed nisl ligula, mauris. Rutrum pharetra, turpis fames per a lorem sed dolor",2023-03-23T04:54:26Z,905747|21488|201701|121733|689611
880349,189634,"Lorem ipsum dolor sit amet, fermentum eget natoque erat sociis eu sem libero eu in. Lacus sed id erat erat",2023-03-23T09:36:26Z,331344|874763
172485,625439,"Lorem ipsum dolor sit amet, taciti torquent nulla sed. Ut, faucibus, turpis commodo metus in facilisis sapien nulla. Conubia curae",2023-03-23T10:18:09Z,244879|438259|455029
969081,101071,"Lorem ipsum dolor sit amet, hac cras congue sed natoque blandit, id et in cum. Volutpat nulla auctor non eu,",2023-03-23T13:40:46Z,813654|78723|358450|139112|173816
840021,795571,"Lorem ipsum dolor sit amet, lorem, neque nam dis curabitur varius ad vitae. In, integer, mus sed quam varius id.",2023-03-23T15:40:37Z,826973|656290
601153,46094,"Lorem ipsum dolor sit amet, eu etiam faucibus, in. Nulla facilisis, imperdiet, ut sed non vestibulum pellentesque sed? Nec eleifend",2023-03-24T02:58:36Z,121733|197002|727113|944729
670928,106179,"Lorem ipsum dolor sit amet, eget libero ac quis maximus aliquam in in integer ut non nullam. Nisl libero ut",2023-03-24T09:38:28Z,794454|641064|951686|425558|868358
265192,748301,"Lorem ipsum dolor sit amet, nibh sed hendrerit nibh diam sapien. Rhoncus pulvinar purus, et, interdum faucibus ullamcorper. Habitasse semper",2023-03-24T20:37:43Z,796725|277075|938736|116530
243185,828726,"Lorem ipsum dolor sit amet, egestas porta aliquam lorem magna, dictumst vel sit scelerisque torquent. Ligula neque nisl tincidunt molestie,",2023-03-24T22:28:45Z,52525|369169|788797|237110|84000
54014,238622,"Lorem ipsum dolor sit amet, habitant, interdum sed lacinia, ut, hendrerit netus egestas nisi. Ex sed, donec est aliquet a",2023-03-24T22:32:57Z,208960|522697
922475,23780,"Lorem ipsum dolor sit amet, ad sit suscipit magna purus integer in proin odio eget egestas. Sit et sed ante",2023-03-25T01:17:15Z,823569|928951|282139|451517
395246,85124,"Lorem ipsum dolor sit amet, in sit lobortis sit gravida, ut tempor cras enim massa vitae. Nibh, est ultrices orci",2023-03-25T08:04:48Z,127015
629032,436006,"Lorem ipsum dolor sit amet, imperdiet nibh facilisis sit, elementum maecenas suspendisse. Leo ligula non et in blandit eget est,",2023-03-25T10:48:05Z,604681|320328
879805,315325,"Lorem ipsum dolor sit amet, vitae vitae feugiat ut ipsum rutrum augue, aenean venenatis. Quis sed nunc suspendisse diam parturient",2023-03-25T10:56:06Z,100653|222949|292038
834300,483947,"Lorem ipsum dolor sit amet, penatibus elementum pellentesque lacus mattis nisi, maximus sodales consequat. Vitae sed aliquam tempus in lacus",2023-03-25T18:06:45Z,216837|290838|280932|553199|493616
394082,769061,"Lorem ipsum dolor sit amet, phasellus nunc tincidunt pulvinar condimentum aptent nunc. Erat metus natoque a aenean. Sapien non nullam",2023-03-25T19:51:21Z,641880
353467,760029,"Lorem ipsum dolor sit amet, nibh sapien fringilla id ut feugiat. Mattis pellentesque eu pulvinar consectetur cursus ad aliquam non",2023-03-26T09:50:57Z,534552|216837|591227|210633|482887
597640,37626,"Lorem ipsum dolor sit amet, facilisi cras ligula gravida? Non et accumsan, in laoreet egestas ligula conubia eget. Sit netus,",2023-03-26T14:29:34Z,147486
754295,211209,"Lorem ipsum dolor sit amet, eu risus vitae sapien a nunc sodales auctor nullam interdum. Curabitur convallis, sed sed, placerat",2023-03-26T15:52:08Z,161221|260860|888233
394852,680889,"Lorem ipsum dolor sit amet, sem scelerisque sit nibh, quisque, pharetra facilisis magna, in sed, sapien cras. Pellentesque eros sodales",2023-03-26T22:37:21Z,703405
664267,199109,"Lorem ipsum dolor sit amet, dictumst mattis eu dui semper morbi a, tempor semper in tempus. Et, id ut malesuada",2023-03-26T23:08:36Z,214729|253899
828589,390664,"Lorem ipsum dolor sit amet, facilisis eu vivamus nullam a. Sed ipsum accumsan consectetur augue, ligula feugiat donec, lectus diam",2023-03-27T01:18:20Z,577896
635939,48718,"Lorem ipsum dolor sit amet, ut ut lorem dictum. Risus diam cum vulputate dignissim. Suscipit consectetur faucibus in euismod mauris.",2023-03-27T08:12:46Z,429139|813654|537479|692034
571987,836622,"Lorem ipsum dolor sit amet, et elit, rhoncus ligula, pretium felis nunc a class. Sed eros, massa sed nunc in",2023-03-27T11:08:11Z,652000|331648
79434,884578,"Lorem ipsum dolor sit amet, potenti egestas feugiat tristique sed cum eu, conubia mauris. Viverra nostra. Interdum in a fermentum",2023-03-27T11:22:26Z,422275|114564|276769|363488
975499,901237,"Lorem ipsum dolor sit amet, cursus elit felis dictumst integer ornare elementum ac ut ipsum aptent. Lorem himenaeos tristique mauris",2023-03-27T15:25:47Z,825185|201701|626168
632636,624833,"Lorem ipsum dolor sit amet, in nulla aliquam at per convallis eros in viverra amet. Mollis accumsan odio sed vestibulum",2023-03-27T19:56:57Z,591227|25653|993243|232534
422925,922649,"Lorem ipsum dolor sit amet, tristique ac porta nibh quis elit. Vehicula eget eleifend laoreet justo nunc phasellus mauris. In",2023-03-28T04:00:06Z,250166|875873|682222|502991|131125
324864,614244,"Lorem ipsum dolor sit amet, aliquet venenatis dictum sociosqu. Magna congue euismod mollis urna leo ut sapien himenaeos erat. Diam,",2023-03-28T04:15:16Z,562314|102165
513839,250166,"Lorem ipsum dolor sit amet, viverra turpis elit nam sociosqu ac sapien facilisi non rhoncus, fames diam. Est est risus",2023-03-28T07:16:56Z,429139|304515|487932|73946
376296,805652,"Lorem ipsum dolor sit amet, ligula ut sollicitudin fusce tempor taciti eget pretium ac diam. Montes eu accumsan leo commodo,",2023-03-28T09:57:10Z,513068|455792|67253
190000,363983,"Lorem ipsum dolor sit amet, suscipit, vulputate velit mattis lacus, fusce sem turpis vel felis. Pulvinar sit mauris sed in",2023-03-28T10:12:02Z,906726|553593|305462|482367|643572
45925,889208,"Lorem ipsum dolor sit amet, nulla lorem quam habitant dignissim magnis justo. Nec sit, ut mi nec dapibus quis nulla,",2023-03-28T10:44:05Z,250166|14359|544285
287323,284910,"Lorem ipsum dolor sit amet, augue, ut est. Nullam mattis. Ut at venenatis amet amet, parturient imperdiet. In etiam, aliquam",2023-03-28T11:18:48Z,219435|553068|553676|346785
457293,674825,"Lorem ipsum dolor sit amet, amet, suspendisse eget aliquet, sed nostra pellentesque sed purus. Torquent amet donec netus nunc, pharetra",2023-03-28T13:34:25Z,246046|499614|745174|345871
156829,409789,"Lorem ipsum dolor sit amet, curabitur at mauris, et massa fringilla sapien vitae duis metus cursus dolor, velit ac, fringilla.",2023-03-28T14:10:11Z,970726|600749|866819
910397,802108,"Lorem ipsum dolor sit amet, non facilisis nunc adipiscing venenatis risus pretium. Maximus nunc sed. Scelerisque sagittis sem vel ut",2023-03-28T15:17:50Z,483195|805083
771972,320672,"Lorem ipsum dolor sit amet, euismod accumsan in. Mattis id ex aenean nisl finibus eu. Id hac facilisi posuere. Sed",2023-03-29T00:22:16Z,120948|669278|304611|45667
966005,888233,"Lorem ipsum dolor sit amet, senectus sed eu sed leo, vestibulum ad arcu. Vestibulum eu rutrum nam suspendisse euismod, varius",2023-03-29T04:15:25Z,410277
115116,160671,"Lorem ipsum dolor sit amet, et efficitur nibh dictum efficitur turpis, proin turpis velit fusce. Ac, odio interdum neque lacinia",2023-03-29T06:13:33Z,34301|244879|672366|638427
817122,614244,"Lorem ipsum dolor sit amet, convallis rutrum nulla nullam, fermentum mauris cubilia, ut orci. Ipsum gravida et eu ridiculus a,",2023-03-29T06:25:45Z,674825
120394,146383,"Lorem ipsum dolor sit amet, nostra turpis risus sed erat, sollicitudin lectus, finibus enim. Sed sollicitudin sit eu tortor aliquam",2023-03-29T09:03:23Z,951686|243378|432805|307186|915910
676907,284809,"Lorem ipsum dolor sit amet, arcu nunc nibh turpis fermentum. Varius ipsum, himenaeos ante cursus donec ante neque ligula feugiat.",2023-03-29T09:31:58Z,827794|565279
540945,264858,"Lorem ipsum dolor sit amet, diam ligula venenatis sapien iaculis. Eu ut suspendisse, at himenaeos tellus auctor amet nascetur, ante",2023-03-29T11:04:44Z,568035|995214|380536|189634|686700
934408,928951,"Lorem ipsum dolor sit amet, cubilia ullamcorper, et consequat sit pharetra nisi nec vulputate. Aliquam libero ac lacus euismod aenean",2023-03-29T12:28:16Z,664009
182656,48718,"Lorem ipsum dolor sit amet, quisque, ligula tempus sociosqu augue tortor amet lacinia egestas rhoncus ipsum sed sodales ad vivamus.",2023-03-29T12:42:03Z,719365|681910|276115|73946
636709,483195,"Lorem ipsum dolor sit amet, ac fames sed malesuada platea. Faucibus et eu duis. Platea eget vitae nulla ut in",2023-03-29T12:49:56Z,735857|205536|116530|131125
368372,91072,"Lorem ipsum dolor sit amet, vehicula cubilia nec turpis, felis. Pretium, tellus diam tincidunt est. Sit magna sociis senectus adipiscing",2023-03-29T13:11:16Z,483195|421012|576316|581047
617031,667714,"Lorem ipsum dolor sit amet, aptent penatibus ultrices in luctus vel elit ac sed tincidunt malesuada. Eu, ac convallis fermentum",2023-03-29T15:21:49Z,830806|407675|213308|708652
893872,181643,"Lorem ipsum dolor sit amet, mollis nam tellus, eu elit, sed imperdiet non. Fringilla semper at ad aliquet erat duis,",2023-03-29T15:54:12Z,346774|14359|735857
727233,625439,"Lorem ipsum dolor sit amet, tortor conubia fusce egestas tempus est vestibulum. Vel velit in fringilla ac eu per elementum",2023-03-29T19:05:31Z,279853
857810,208960,"Lorem ipsum dolor sit amet, iaculis senectus sed faucibus felis amet blandit nunc sapien. Libero montes cursus, amet netus. Tristique",2023-03-29T20:05:23Z,956373
245463,624833,"Lorem ipsum dolor sit amet, elementum eu tristique, tincidunt class eget sed mauris. Ipsum mauris ut purus dapibus. Cras vulputate",2023-03-30T04:05:25Z,169221|532579|29627
835632,113235,"Lorem ipsum dolor sit amet, tempus auctor quis, varius nibh ultrices habitasse. Tincidunt arcu erat fermentum ut. Bibendum tellus sociis",2023-03-30T06:47:26Z,998915|60125|585373|989556|570802
5773,594125,"Lorem ipsum dolor sit amet, efficitur ullamcorper, tempus mollis taciti eu sociis neque. Est rhoncus sed, et eget, vitae. Nec",2023-03-30T13:10:32Z,35616
271884,232170,"Lorem ipsum dolor sit amet, finibus ac ac dignissim commodo condimentum magna turpis. Neque eget eu netus tellus sollicitudin. Faucibus",2023-03-30T19:51:34Z,616779|302801
388341,871498,"Lorem ipsum dolor sit amet, gravida dictum eget auctor, ac. Lectus pellentesque velit urna nam nec. Molestie mauris nisl quisque,",2023-03-30T20:31:04Z,260860|884578|530206|499614
36444,502991,"Lorem ipsum dolor sit amet, facilisi luctus vitae, orci sed. Amet morbi turpis justo. Risus dolor, luctus nec id. Ante",2023-03-30T21:20:40Z,621069|911885|737211|797681|961742
278566,715177,"Lorem ipsum dolor sit amet, diam facilisis in nascetur lacinia per sed. Ut arcu facilisi phasellus pretium. In in ultrices",2023-03-31T07:21:18Z,596250|146383|481534|882890|531447
964331,287447,"Lorem ipsum dolor sit amet, scelerisque euismod nibh ac nibh ac ut nulla dolor. Dictum arcu mollis erat facilisi ut",2023-03-31T08:18:42Z,999334|748849|682222|132702
687346,839223,"Lorem ipsum dolor sit amet, magnis tempor ante eu turpis vitae. Leo lectus nunc eget sed malesuada. Nulla et. Parturient",2023-03-31T12:08:57Z,798990|889208|91028|389847|826140
390532,29649,"Lorem ipsum dolor sit amet, suscipit nunc. Eget penatibus quam in lacus elementum platea, mauris tristique ut cras. Hac morbi",2023-03-31T12:36:28Z,482887|284910|213308|246046
550845,988377,"Lorem ipsum dolor sit amet, dictumst tellus congue parturient, velit quis mi quis. Elementum tristique a, penatibus etiam amet facilisi",2023-03-31T17:26:04Z,179021|529002|836000|290365|536325
45579,282295,"Lorem ipsum dolor sit amet, feugiat massa, aliquam eget erat tellus. Vel porta hendrerit nulla libero. Leo odio aliquam torquent",2023-03-31T19:28:49Z,284495|182609|822503
452642,88396,"Lorem ipsum dolor sit amet, hac nunc ut lectus duis etiam in eget. Posuere orci pharetra luctus maecenas himenaeos. Eget,",2023-03-31T20:34:54Z,878778|304515|519795|685053
4726,403444,"Lorem ipsum dolor sit amet, maecenas gravida ultricies orci lobortis natoque interdum nunc, lobortis donec sodales. Quis maximus commodo inceptos",2023-04-01T10:30:19Z,805083|735857|157433
333570,743340,"Lorem ipsum dolor sit amet, metus fames tristique class vel turpis, non, ac massa sed mauris. Euismod erat nulla non",2023-04-01T13:10:19Z,280592|10873
206219,650175,"Lorem ipsum dolor sit amet, id a magna. Condimentum ut orci non. Cras sociosqu ac sapien magna class non cursus",2023-04-01T13:54:42Z,499533|277075
225465,817846,"Lorem ipsum dolor sit amet, et, sem neque nunc, sapien praesent? Elit eu porttitor, tempus et. Lobortis, ultrices ac dis",2023-04-01T19:12:50Z,176701|489987|991190|284809
413706,276769,"Lorem ipsum dolor sit amet, nascetur ornare facilisi, nulla ut eu imperdiet maximus nulla, lobortis nisi iaculis! Augue mollis in",2023-04-02T01:41:54Z,902448|600646
450559,334144,"Lorem ipsum dolor sit amet, auctor gravida donec in turpis sed suspendisse ut ac. Tincidunt duis odio. Rutrum eu justo",2023-04-02T13:44:02Z,334951|4552
530198,84349,"Lorem ipsum dolor sit amet, ligula proin sed penatibus. Augue quis semper auctor malesuada mollis. Nunc eget nec, vehicula arcu",2023-04-02T14:25:43Z,549412|566767|888583|403444
594119,345971,"Lorem ipsum dolor sit amet, cras primis vel mauris. Purus venenatis. Tincidunt conubia ante non nisi maecenas odio habitasse sed",2023-04-02T18:17:04Z,983488|605345|957418
457873,79552,"Lorem ipsum dolor sit amet, laoreet fringilla eu aliquam imperdiet tempus vivamus eu vulputate. Aliquet rutrum mollis nulla dignissim libero.",2023-04-03T01:33:22Z,973873|147977|639199|841478|345871
682123,784629,"Lorem ipsum dolor sit amet, odio ultricies purus risus himenaeos! Porttitor phasellus vel porta lacinia aliquam vestibulum nisl. Elementum et",2023-04-03T06:02:34Z,625900|35616
68425,264376,"Lorem ipsum dolor sit amet, sapien interdum id sed in donec neque. Suspendisse, tempor porta, ut velit vitae hendrerit malesuada.",2023-04-03T07:19:11Z,531447|113235|354878|466925|885888
75199,182048,"Lorem ipsum dolor sit amet, eu sem arcu est semper lorem maximus in id purus cras. Sed vehicula in ipsum",2023-04-03T14:55:08Z,889208|232170|215586|4552
779457,664556,"Lorem ipsum dolor sit amet, in porttitor lectus eu, pellentesque orci libero turpis taciti. Suscipit ut cras, dolor. Ipsum sed,",2023-04-03T16:58:56Z,3524|120948|219435
950063,525925,"Lorem ipsum dolor sit amet, posuere posuere rhoncus aliquam aliquam aptent felis. Et nec vel. Faucibus, eu ultrices sed vehicula",2023-04-03T19:02:49Z,825283|743592
799684,131125,"Lorem ipsum dolor sit amet, mus penatibus tincidunt orci eget aliquet etiam hac leo. Ut finibus suscipit elit eleifend sed,",2023-04-04T02:31:26Z,671388|277273|216518
127716,170243,"Lorem ipsum dolor sit amet, nunc augue. Euismod ornare risus himenaeos in lorem sapien sed sem. Donec in at, senectus",2023-04-04T04:21:15Z,721072
723593,420593,"Lorem ipsum dolor sit amet, tortor nascetur quam et odio. Cum lacus cras netus eget porttitor accumsan gravida feugiat. Netus",2023-04-04T22:22:17Z,382868|499533|78723
113959,695517,"Lorem ipsum dolor sit amet, ultricies maecenas pretium sit. Suspendisse in sed, quisque lacus quam aenean conubia urna. Curae nam",2023-04-05T03:27:37Z,308269|764339|8299|86856
7577,865300,"Lorem ipsum dolor sit amet, sapien himenaeos sed sed vestibulum magna maecenas suscipit! Ac id, ex sed est. Vestibulum habitant",2023-04-05T05:47:20Z,159530|535999|917473
109344,86856,"Lorem ipsum dolor sit amet, ante ornare diam commodo, sed curae ipsum diam curabitur hac proin. Fusce vestibulum ligula, luctus",2023-04-05T12:26:17Z,836719|796725
82639,25653,"Lorem ipsum dolor sit amet, etiam pretium egestas ut platea ac, volutpat sodales laoreet dolor id. Cras sed dapibus montes",2023-04-05T12:41:53Z,381220|516545|113235|316403|568035
893346,573654,"Lorem ipsum dolor sit amet, ut erat justo maecenas, ut quis sed semper dignissim sit? Ridiculus nibh congue ligula pellentesque",2023-04-05T19:25:48Z,483195
165513,605345,"Lorem ipsum dolor sit amet, aliquam nunc curabitur nibh est ac. Augue ultricies nullam nec habitant litora. Tellus habitasse velit",2023-04-05T22:03:57Z,553593|33227|338649|147977
887456,257011,"Lorem ipsum dolor sit amet, aliquam eu finibus neque, pretium velit magna auctor sit arcu. Auctor lacus ac. Enim taciti",2023-04-05T23:42:58Z,58903
278466,302801,"Lorem ipsum dolor sit amet, luctus lorem lorem porttitor pretium amet. Porttitor integer arcu, sit mattis curae mollis sit mauris",2023-04-06T00:35:08Z,671474|368367
804066,409789,"Lorem ipsum dolor sit amet, sem egestas metus faucibus ultrices at, vel sociis. Diam elit turpis ipsum felis dui. Vitae",2023-04-06T01:53:37Z,664009|936704
578985,529002,"Lorem ipsum dolor sit amet, rutrum sit pulvinar at, vel faucibus vestibulum mi. Placerat ut est tortor, suspendisse feugiat. Ac",2023-04-06T03:35:09Z,988377|381220|315013
744142,733529,"Lorem ipsum dolor sit amet, luctus egestas, tortor scelerisque, ligula nulla. Augue suscipit nunc facilisis justo, vel magnis auctor luctus",2023-04-06T05:12:57Z,622347|232867
727093,671474,"Lorem ipsum dolor sit amet, tempus arcu congue feugiat consectetur. Nec donec curabitur fermentum pellentesque ornare est massa? Congue tellus",2023-04-06T09:39:10Z,689611
114704,269790,"Lorem ipsum dolor sit amet, at aenean et purus gravida amet neque donec. Ligula nibh facilisi magna, in aliquam donec.",2023-04-06T11:43:38Z,423404|957277
638489,971830,"Lorem ipsum dolor sit amet, magnis, aliquet vulputate, rutrum sed est sed aptent enim mauris, nisl malesuada nulla. Vitae, integer",2023-04-06T12:20:50Z,572929|649302
478895,807888,"Lorem ipsum dolor sit amet, at leo maecenas cras, libero amet sem natoque bibendum tempus. Mi pellentesque leo etiam gravida",2023-04-06T13:19:34Z,289974|497243|57518|702022
53831,304560,"Lorem ipsum dolor sit amet, vitae pellentesque aliquet tellus augue nec, sit quis aenean, enim. Orci eros faucibus urna sed",2023-04-07T14:30:08Z,436006
763358,668451,"Lorem ipsum dolor sit amet, massa et sed consequat dapibus, ridiculus per ullamcorper magna quisque et eleifend. Amet ut interdum",2023-04-07T14:58:06Z,213308|764339|535999|12595|591449
473986,340539,"Lorem ipsum dolor sit amet, ac lacus nostra. Amet sed. Torquent consectetur ultrices, dolor cum, donec. Lorem nunc in, posuere",2023-04-07T16:06:33Z,532268|748849|346785|655451|687765
492298,640732,"Lorem ipsum dolor sit amet, placerat odio varius sit fringilla mattis non est, parturient magna vestibulum. Ac risus interdum accumsan",2023-04-07T21:47:31Z,980298|686864|762270|937935|247955
123842,570802,"Lorem ipsum dolor sit amet, ligula tellus ut fermentum mattis libero nisi nisl justo tempor semper sapien. In, integer non",2023-04-07T23:21:25Z,741889
304219,15588,"Lorem ipsum dolor sit amet, aliquam eget scelerisque tortor eu dolor pellentesque facilisis rhoncus lacinia at et fusce dictumst purus.",2023-04-08T00:57:27Z,455029|276406|354878|287447|44916
155580,493616,"Lorem ipsum dolor sit amet, fusce quam augue per mauris suspendisse elit sed quisque laoreet quis nisi. Erat nibh, et",2023-04-08T03:58:36Z,572304|836000|986890
218304,978817,"Lorem ipsum dolor sit amet, lacinia cursus erat sem at duis dolor natoque ligula. Ut rhoncus elit. Ac, porta sit",2023-04-08T08:39:36Z,737211|269790|338649|469053|784097
146826,600646,"Lorem ipsum dolor sit amet, in tempus placerat viverra lectus in interdum. Quisque platea in sodales non posuere fusce magnis",2023-04-08T22:15:00Z,269056|269527|424685|839223|88396
688683,879748,"Lorem ipsum dolor sit amet, pellentesque mattis non eleifend ridiculus odio nibh ac id risus magna fermentum mauris vel. Sed",2023-04-08T22:24:02Z,225988|497243
428562,731518,"Lorem ipsum dolor sit amet, orci cras nulla, blandit tempus ac fames, eros accumsan finibus, ut. Ipsum augue aliquet ligula",2023-04-08T22:35:19Z,553593|100679
997940,932948,"Lorem ipsum dolor sit amet, fusce, pellentesque pulvinar neque mauris, laoreet dapibus elementum ipsum. Torquent non non vitae nec, nisi",2023-04-09T06:30:56Z,499533|239833|242108|438259
100447,487932,"Lorem ipsum dolor sit amet, purus ipsum integer, nunc erat conubia, elementum ullamcorper. Sociosqu vel. Taciti consequat proin eros, per",2023-04-09T13:45:15Z,738583|44938|951686
394546,234593,"Lorem ipsum dolor sit amet, at risus, sed ex lacus, mus sapien sem sed urna. Amet luctus eros phasellus, rutrum",2023-04-09T14:00:55Z,161152|787400|575742|121671
835680,828429,"Lorem ipsum dolor sit amet, tincidunt rutrum sociis gravida magna. Ex tortor in dolor nibh auctor vel. Feugiat pellentesque maximus",2023-04-09T20:15:57Z,717236|489940|306441
208524,659512,"Lorem ipsum dolor sit amet, ut nunc pharetra rhoncus sed magnis potenti. Montes, dapibus maecenas nam diam sollicitudin massa turpis",2023-04-09T22:29:11Z,252113|600646|438259|480601|529002
27266,132961,"Lorem ipsum dolor sit amet, facilisis aliquam nunc turpis vitae curae massa mollis in sollicitudin. In facilisi nullam blandit magna.",2023-04-10T00:45:05Z,717236|362921
918470,175711,"Lorem ipsum dolor sit amet, vitae dolor, malesuada sed at odio, taciti montes. Nunc sagittis per euismod sodales. Vitae cras",2023-04-10T03:07:53Z,245493|660433
636504,654376,"Lorem ipsum dolor sit amet, in vestibulum suscipit hendrerit metus. Ipsum purus id etiam parturient lacus eget. Molestie aenean. Quis",2023-04-10T04:28:30Z,198822
326040,956490,"Lorem ipsum dolor sit amet, sed taciti varius id tempus sed sociosqu. Eget praesent mauris mauris praesent diam imperdiet. Eu",2023-04-10T08:36:18Z,251546|243599
96815,370206,"Lorem ipsum dolor sit amet, hendrerit fusce, ut vestibulum vestibulum sed velit. Ante massa nec lobortis platea et non pellentesque.",2023-04-10T11:09:01Z,381220|299955|831543
291389,764339,"Lorem ipsum dolor sit amet, nisl mi ullamcorper feugiat eros eros fermentum dolor ex in. Turpis non sem gravida tortor",2023-04-10T15:33:12Z,790109|836350
961470,841478,"Lorem ipsum dolor sit amet, sociis montes eleifend facilisis in lobortis convallis, felis, eget. Ex vehicula in suspendisse, ut faucibus,",2023-04-10T15:47:11Z,315325|885888|210959
318309,349533,"Lorem ipsum dolor sit amet, elementum vitae in mi. Urna a ornare per bibendum primis lobortis amet. Et a fermentum",2023-04-10T18:13:08Z,837838|625439|553068
940912,600749,"Lorem ipsum dolor sit amet, nisl venenatis vulputate ornare nec semper nostra. Et id non mi sed turpis mauris donec",2023-04-11T02:27:30Z,20910
836608,830806,"Lorem ipsum dolor sit amet, fames ultrices in quis, vestibulum non, elementum. In elementum conubia urna aptent sed mus arcu.",2023-04-11T13:40:53Z,393089
617399,210057,"Lorem ipsum dolor sit amet, ac eget, nisi. Sapien nisi vitae sed mus sociosqu, efficitur vitae commodo. In tincidunt primis",2023-04-11T17:01:32Z,78723|190661|354187|516545|84000
475113,436006,"Lorem ipsum dolor sit amet, aliquam, donec rutrum nunc aliquam vitae? Eu dictumst sit nulla mauris ut. Ac turpis mattis",2023-04-11T17:33:56Z,431908|594235|837744|482367|17021
10567,271861,"Lorem ipsum dolor sit amet, lacus adipiscing ridiculus fringilla dapibus vitae, torquent et ut et. A ac mus ac aliquet",2023-04-11T17:49:22Z,815021|553068
665849,190048,"Lorem ipsum dolor sit amet, ligula sapien porttitor, ac nulla dui a cum. Adipiscing ut sociosqu vehicula arcu nulla metus.",2023-04-11T20:35:31Z,100653|508145|482887|280592
505362,887807,"Lorem ipsum dolor sit amet, fringilla pulvinar nunc pellentesque turpis. Maximus et sed nunc diam porttitor justo, amet faucibus dui",2023-04-11T20:49:01Z,441079|372373|15712
156883,885053,"Lorem ipsum dolor sit amet, dapibus elementum ut vestibulum nullam lorem egestas nibh. Ullamcorper risus nam felis vitae, velit sagittis?",2023-04-12T00:43:47Z,585044|121733|420593|507356|416516
736229,412338,"Lorem ipsum dolor sit amet, suscipit, hac habitasse praesent penatibus pretium sagittis praesent? In ut per nisl nec blandit nec",2023-04-12T06:11:25Z,977880|420593|413551
851244,139112,"Lorem ipsum dolor sit amet, condimentum vehicula dis sem, metus aliquam mollis. Sed in torquent facilisis eu fames consectetur odio",2023-04-12T11:52:12Z,185929|464059
799254,730083,"Lorem ipsum dolor sit amet, enim, pulvinar maximus laoreet odio dapibus scelerisque ornare. Pretium ut molestie nullam quisque varius, in",2023-04-12T12:39:32Z,156616
5396,825185,"Lorem ipsum dolor sit amet, convallis, velit diam ante, dui facilisis ut, nec ac. Dapibus morbi dui amet posuere sapien",2023-04-12T15:14:03Z,3721|260601|147209
326259,955646,"Lorem ipsum dolor sit amet, non turpis finibus aliquam volutpat phasellus etiam aliquet. Sed volutpat natoque ut in justo, aptent",2023-04-12T19:26:47Z,639199
697933,442907,"Lorem ipsum dolor sit amet, ad cursus nam quisque, purus ligula. Diam dictum, facilisi, eu ut non quis a condimentum.",2023-04-12T22:16:12Z,89989
382271,889208,"Lorem ipsum dolor sit amet, vivamus mi varius dapibus magna conubia, sed. Euismod primis mauris amet in ut porta, dolor",2023-04-13T02:47:11Z,630386
843894,434171,"Lorem ipsum dolor sit amet, vulputate amet class vestibulum quis. Erat tellus quis sociis lacus platea urna neque aptent suspendisse,",2023-04-13T05:31:05Z,667714|657089|508786|83042
529080,559000,"Lorem ipsum dolor sit amet, ridiculus non ut etiam augue sit eu. Varius purus lobortis sed nisl. Quis nunc, ac",2023-04-13T07:42:10Z,885291
739608,878778,"Lorem ipsum dolor sit amet, vel vivamus quis neque penatibus nisl nunc nibh blandit nulla. Lacus ante. Eu quisque nec?",2023-04-13T07:51:52Z,409789|970726|314337
825533,114564,"Lorem ipsum dolor sit amet, iaculis lacinia orci porttitor eu ante. Et, molestie. Orci praesent amet sapien ac cras nostra",2023-04-13T07:53:25Z,822503|253467
173058,479286,"Lorem ipsum dolor sit amet, diam penatibus arcu eu molestie dolor sed non eu in, quis nam. Duis, vel non",2023-04-13T14:51:30Z,955824|459179
